Ticker,neg,neu,pos,compound,Title,url
ACXM,0.09,0.799,0.111,0.3612,Marketing services chief departs Acxiom after a month - Acxiom Corporation (NASDAQ:ACXM),http://seekingalpha.com/news/2727666-marketing-services-chief-departs-acxiom-after-a-month?source=feed_symbol_acxm
ACXM,0.05,0.873,0.077,0.25,Acxiom narrows loss affirms low-side guidance - Acxiom Corporation (NASDAQ:ACXM),http://seekingalpha.com/news/2700615-acxiom-narrows-loss-affirms-low-side-guidance?source=feed_symbol_acxm
ACXM,0.03,0.957,0.013,-0.34,Acxiom off 10.7% in late trade after Q4 earnings - Acxiom Corporation (NASDAQ:ACXM),http://seekingalpha.com/news/2540226-acxiom-off-10_7-percent-in-late-trade-after-q4-earnings?source=feed_symbol_acxm
ACXM,0.0,0.961,0.039,0.6249,Acxiom revenues beat though down from prior year - Acxiom Corporation (NASDAQ:ACXM),http://seekingalpha.com/news/2274176-acxiom-revenues-beat-though-down-from-prior-year?source=feed_symbol_acxm
ACXM,0.068,0.866,0.066,0.7514,The Fundamentals Versus Technicals For Acxiom - Acxiom Corporation (NASDAQ:ACXM),http://seekingalpha.com/article/2674435-the-fundamentals-versus-technicals-for-acxiom?source=feed_symbol_acxm
ACXM,0.044,0.815,0.141,0.9783,Acxiom (ACXM) Stock Chart Shows 30% Upside,http://us.rd.yahoo.com/finance/external/tsmfe/rss/SIG=12iug820r/*http://www.thestreet.com/story/13282697/1/acxiom-acxm-chart-shows-30-upside.html?puc=yahoo&amp;cm_ven=YAHOO
ACXM,0.0,0.929,0.071,0.7906,ACXM quotes & news  Google Finance,http://www.google.ca/finance?q=NASDAQ:ACXM&amp;amp;client=news-rss&amp;amp;ei=U6ouVtGRKZDKjAHsq6P4DQ
ACXM,0.0,0.929,0.071,0.7906,ACXM quotes & news  Google Finance,http://www.google.ca/finance?q=NASDAQ:ACXM&amp;amp;client=news-rss&amp;amp;ei=U6ouVtGRKZDKjAHsq6P4DQ
ACXM,0.024,0.843,0.133,0.992,Company Shares of Acxiom Corporation (NASDAQ:ACXM) Rally 1.2%,http://www.americantradejournal.com/company-shares-of-acxiom-corporation-nasdaqacxm-rally-1-2/6133025/
ACXM,0.013,0.873,0.115,0.9839,Brokerage Views on Acxiom Corporation (NASDAQ:ACXM),http://www.themarketsdaily.com/analyst-views/brokerage-views-on-acxiom-corporation-nasdaqacxm-2/74411/
ACXM,0.033,0.857,0.11,0.9876,Shares of Acxiom Corporation (NASDAQ:ACXM) Sees Large Outflow of Money,http://newswatchinternational.com/news/shares-of-acxiom-corporation-nasdaqacxm-sees-large-outflow-of-money.html
ACXM,0.024,0.843,0.133,0.9932,Company Shares of Acxiom Corporation (NASDAQ:ACXM) Rally 1.32%,http://www.americantradejournal.com/company-shares-of-acxiom-corporation-nasdaqacxm-rally-1-32/697796/
CRAY,0.0,0.936,0.064,0.5106,Cray supercomputer to model Swiss weather - Cray Inc (NASDAQ:CRAY),http://seekingalpha.com/news/2798156-cray-supercomputer-to-model-swiss-weather?source=feed_symbol_cray
CRAY,0.1,0.856,0.043,-0.6697,Cray now down 5.8% following earnings/guidance - Cray Inc (NASDAQ:CRAY),http://seekingalpha.com/news/2682045-cray-now-down-5_8-percent-following-earnings-guidance?source=feed_symbol_cray
CRAY,0.033,0.816,0.151,0.9552,Cray up 8.9% after Q2 beat; full-year spending/margin guidance cut - Cray Inc (NASDAQ:CRAY),http://seekingalpha.com/news/2679425-cray-up-8_9-percent-after-q2-beat-full-year-spending-margin-guidance-cut?source=feed_symbol_cray
CRAY,0.0,0.904,0.096,0.9201,Stifel: Cray gaining high-end supercomputer share against IBM - Cray Inc (NASDAQ:CRAY),http://seekingalpha.com/news/2626645-stifel-cray-gaining-high-end-supercomputer-share-against-ibm?source=feed_symbol_cray
CRAY,0.075,0.887,0.038,-0.4124,Cray up 10.9% after Q1 EPS beat strong Q2 guidance - Cray Inc (NASDAQ:CRAY),http://seekingalpha.com/news/2494246-cray-up-10_9-percent-after-q1-eps-beat-strong-q2-guidance?source=feed_symbol_cray
CRAY,0.026,0.774,0.2,0.899,Cray: Lumpy Revenues Obscure A Strong Buy - Cray Inc (NASDAQ:CRAY),http://seekingalpha.com/article/3067616-cray-lumpy-revenues-obscure-a-strong-buy?source=feed_symbol_cray
CRAY,0.039,0.926,0.035,-0.1779,Major tech gainers/decliners: CCIH WUBA NMBL FARO CRAY ANGI - ChinaCache International (NASDAQ:CCIH),http://seekingalpha.com/news/2402736-major-tech-gainers-decliners-ccih-wuba-nmbl-faro-cray-angi?source=feed_symbol_cray
CRAY,0.0,0.961,0.039,0.4767,Cray strikes 5-petaflop supercomputer/storage deal - Cray Inc (NASDAQ:CRAY),http://seekingalpha.com/news/2389106-cray-strikes-5-petaflop-supercomputer-storage-deal?source=feed_symbol_cray
CRAY,0.016,0.95,0.034,0.2732,Notable tech gainers/decliners: AMBA ANET CRAY XONE FUEL - Ambarella (NASDAQ:AMBA),http://seekingalpha.com/news/2317586-notable-tech-gainers-decliners-amba-anet-cray-xone-fuel?source=feed_symbol_cray
CRAY,0.028,0.861,0.111,0.8907,Cray ticks lower after beating estimates guiding in-line - Cray Inc (NASDAQ:CRAY),http://seekingalpha.com/news/2295366-cray-ticks-lower-after-beating-estimates-guiding-in-line?source=feed_symbol_cray
CRAY,0.0,0.875,0.125,0.891,CRAY quotes & news  Google Finance,http://www.google.ca/finance?q=NASDAQ:CRAY&amp;amp;client=news-rss&amp;amp;ei=U6ouVvGeL8bDjAGmzpu4DQ
CRAY,0.0,0.875,0.125,0.891,CRAY quotes & news  Google Finance,http://www.google.ca/finance?q=NASDAQ:CRAY&amp;amp;client=news-rss&amp;amp;ei=U6ouVvGeL8bDjAGmzpu4DQ
CRAY,0.022,0.838,0.14,0.983,Analysts See Decline of Cray Inc. (CRAY) Earnings Per Share,http://www.octafinance.com/analysts-see-decline-of-cray-inc-cray-earnings-per-share/
CRAY,0.015,0.876,0.11,0.9868,CRAY) Price Target Update,http://www.moneyflowindex.org/cray-inc-nasdaqcray-price-target-update/3136621/
CRAY,0.061,0.81,0.129,0.9872,Why Cray Inc (CRAY) is Enjoying Double-Digit Gains,http://www.thestreet.com/story/12215068/1/why-cray-inc-cray-is-enjoying-double-digit-gains.html
CRAY,0.005,0.923,0.072,0.9652,Cray Inc (NASDAQ:CRAY) Given $37 Consensus Target,http://www.themarketsdaily.com/analyst-actions/cray-inc-nasdaqcray-given-37-consensus-target/72810/
SGI,0.0,0.87,0.13,0.8779,SGI issues strong revenue guidance in-line EPS guidance. - Silicon Graphics Inc. (NASDAQ:SGI),http://seekingalpha.com/news/2824126-sgi-issues-strong-revenue-guidance-in-line-eps-guidance?source=feed_symbol_sgi
SGI,0.029,0.915,0.056,0.5994,Notable tech gainers/decliners: CYBR JD XOOM VEEV QIWI SGI - Silver Spring Networks (NYSE:SSNI),http://seekingalpha.com/news/2307026-notable-tech-gainers-decliners-cybr-jd-xoom-veev-qiwi-sgi?source=feed_symbol_sgi
SGI,0.024,0.938,0.038,0.2732,SGI -11.2%; FQ3 guidance light financing deal announced - Silicon Graphics Inc. (NASDAQ:SGI),http://seekingalpha.com/news/2256666-sgi-minus-11_2-percent-fq3-guidance-light-financing-deal-announced?source=feed_symbol_sgi
SGI,0.0,0.841,0.159,0.8834,SGI rallies after announcing CUNY deal - Silicon Graphics Inc. (NASDAQ:SGI),http://seekingalpha.com/news/2222626-sgi-rallies-after-announcing-cuny-deal?source=feed_symbol_sgi
SGI,0.046,0.892,0.062,0.0772,SGI +6.2%: Needham upgrades calls company a top 2015 pick - Silicon Graphics Inc. (NASDAQ:SGI),http://seekingalpha.com/news/2170625-sgi-plus-6_2-percent-needham-upgrades-calls-company-a-top-2015-pick?source=feed_symbol_sgi
SGI,0.0,0.918,0.082,0.5267,SGI extends buyback program by a year - Silicon Graphics Inc. (NASDAQ:SGI),http://seekingalpha.com/news/2135415-sgi-extends-buyback-program-by-a-year?source=feed_symbol_sgi
SGI,0.0,0.966,0.034,0.4404,SGI -9.9%; FQ1 sales miss overshadows guidance - Silicon Graphics Inc. (NASDAQ:SGI),http://seekingalpha.com/news/2077695-sgi-minus-9_9-percent-fq1-sales-miss-overshadows-guidance?source=feed_symbol_sgi
SGI,0.0,0.868,0.132,0.9983,SGI Introduces Breakthrough Intel-Based System to Enable Real-Time Business With Oracle Database In-Memory,http://us.rd.yahoo.com/finance/news/rss/story/*http://finance.yahoo.com/news/sgi-introduces-breakthrough-intel-based-130000114.html
SGI,0.008,0.892,0.1,0.9954,SGI Exceeds 200 Terabyte Milestone in Total Systems Running SAP HANA(R),http://us.rd.yahoo.com/finance/news/rss/story/*http://finance.yahoo.com/news/sgi-exceeds-200-terabyte-milestone-065900791.html
SGI,0.049,0.867,0.084,0.9791,SGI Updates Guidance for First Quarter Fiscal 2016 Financial Results and Announces First Quarter 2016 Conference Call Information,http://us.rd.yahoo.com/finance/news/rss/story/*http://finance.yahoo.com/news/sgi-updates-guidance-first-quarter-200500717.html
SGI,0.0,0.935,0.065,0.8934,SGI to Host Annual Investor Day November 18 2015,http://us.rd.yahoo.com/finance/news/rss/story/*http://finance.yahoo.com/news/sgi-host-annual-investor-day-130000510.html
SGI,0.088,0.808,0.104,-0.0735,University of Copenhagen Uses SGI Supercomputer to Decode How Mutations Rewire Cancer Cells,http://us.rd.yahoo.com/finance/news/rss/story/*http://finance.yahoo.com/news/university-copenhagen-uses-sgi-supercomputer-170000763.html
SGI,0.004,0.909,0.088,0.9948,SGI and IT4Innovations Announce a TOP500 Supercomputer in Europe -- Salomon,http://us.rd.yahoo.com/finance/news/rss/story/*http://finance.yahoo.com/news/sgi-it4innovations-announce-top500-supercomputer-070100191.html
SGI,0.0,0.899,0.101,0.9628,Quotes for SGI,http://us.rd.yahoo.com/finance/news/rss/story/*http://finance.yahoo.com/q/ud?s=SGI
SGI,0.006,0.88,0.114,0.9945,Gartner Positions SGI in 2015 Magic Quadrant for Integrated Systems,http://us.rd.yahoo.com/finance/news/rss/story/*http://finance.yahoo.com/news/gartner-positions-sgi-2015-magic-200000494.html
SGI,0.067,0.883,0.05,-0.4404,SGI reports 4Q loss,http://us.rd.yahoo.com/finance/news/rss/story/*http://finance.yahoo.com/news/sgi-reports-4q-loss-214601578.html
SGI,0.014,0.785,0.201,0.9628,SGI quotes & news  Google Finance,http://www.google.ca/finance?q=CVE:SGI&amp;amp;client=news-rss&amp;amp;ei=U6ouVvGbMMuO2Aaz8Kv4Bg
SGI,0.014,0.785,0.201,0.9628,SGI quotes & news  Google Finance,http://www.google.ca/finance?q=CVE:SGI&amp;amp;client=news-rss&amp;amp;ei=U6ouVvGbMMuO2Aaz8Kv4Bg
MDSO,0.03,0.97,0.0,-0.2732,Medidata down 4% after naming new sales chief - Medidata Solutions Inc. (NASDAQ:MDSO),http://seekingalpha.com/news/2819176-medidata-down-4-percent-after-naming-new-sales-chief?source=feed_symbol_mdso
MDSO,0.022,0.926,0.052,0.4404,Medidata down 8% after Q2 beat guidance reiteration - Medidata Solutions Inc. (NASDAQ:MDSO),http://seekingalpha.com/news/2641855-medidata-down-8-percent-after-q2-beat-guidance-reiteration?source=feed_symbol_mdso
MDSO,0.021,0.895,0.084,0.7717,Medidata up 15.1% on Q1 beat billings strength guidance reiteration - Medidata Solutions Inc. (NASDAQ:MDSO),http://seekingalpha.com/news/2448246-medidata-up-15_1-percent-on-q1-beat-billings-strength-guidance-reiteration?source=feed_symbol_mdso
MDSO,0.111,0.81,0.08,-0.5198,Medidata: A Short Thesis - Medidata Solutions Inc. (NASDAQ:MDSO),http://seekingalpha.com/article/3044266-medidata-a-short-thesis?source=feed_symbol_mdso
MDSO,0.0,0.858,0.142,0.9325,MDSO quotes & news  Google Finance,http://www.google.ca/finance?q=NASDAQ:MDSO&amp;amp;client=news-rss&amp;amp;ei=qKouVsGTOI3ZjAHJ9ZToBA
MDSO,0.0,0.858,0.142,0.9325,MDSO quotes & news  Google Finance,http://www.google.ca/finance?q=NASDAQ:MDSO&amp;amp;client=news-rss&amp;amp;ei=qKouVsGTOI3ZjAHJ9ZToBA
MDSO,0.032,0.833,0.135,0.9941,Shares of Medidata Solutions Inc. (NASDAQ:MDSO) Sees Large Inflow of Net Money Flow,http://www.americantradejournal.com/shares-of-medidata-solutions-inc-nasdaqmdso-sees-large-inflow-of-net-money-flow/6131528/
MDSO,0.019,0.833,0.149,0.9964,MDSO) has Adopted by Walvax Biotechnology Co.,http://www.streetreport.co/medidata-solutions-inc-nasdaqmdso-has-adopted-by-walvax-biotechnology-co/23661/
MDSO,0.041,0.87,0.088,0.9287,Company Shares of Medidata Solutions Inc. (NASDAQ:MDSO) Drops by -4.79%,http://newswatchinternational.com/news/company-shares-of-medidata-solutions-inc-nasdaqmdso-drops-by-4-79.html
MDSO,0.029,0.851,0.12,0.9858,Company Shares of Medidata Solutions Inc. (NASDAQ:MDSO) Drops by -2.41%,http://www.americantradejournal.com/company-shares-of-medidata-solutions-inc-nasdaqmdso-drops-by-2-41/698034/
SYRX,0.045,0.834,0.121,0.999,Sysorex: 3 Reasons To Love (Fear) This Company - Sysorex Global Holdings Corp. (NASDAQ:SYRX),http://seekingalpha.com/article/3227626-sysorex-3-reasons-to-love-fear-this-company?source=feed_symbol_syrx
SYRX,0.046,0.846,0.107,0.999,Be Careful Before You Jump Into Yet Another Rally In Sysorex - Sysorex Global Holdings Corp. (NASDAQ:SYRX),http://seekingalpha.com/article/3057526-be-careful-before-you-jump-into-yet-another-rally-in-sysorex?source=feed_symbol_syrx
SYRX,0.059,0.834,0.107,0.9119,Sysorex (SYRX) Stock Gains After $91 Million IT Contract,http://us.rd.yahoo.com/finance/external/tsmfe/rss/SIG=13b9l77sc/*http://www.thestreet.com/story/13314343/1/sysorex-syrx-stock-gains-after-signing-91-million-contract.html?puc=yahoo&amp;cm_ven=YAHOO
SYRX,0.005,0.909,0.086,0.9831,SYRX: Leveraging its New Technologies to Cross-Promote Services and Generate Synergies,http://us.rd.yahoo.com/finance/news/rss/story/*http://finance.yahoo.com/news/syrx-leveraging-technologies-cross-promote-192500055.html
SYRX,0.0,0.913,0.087,0.8402,SYRX quotes & news  Google Finance,http://www.google.ca/finance?q=NASDAQ:SYRX&amp;amp;client=news-rss&amp;amp;ei=uKouVpmYH9e5jAHZ1rHgDA
SYRX,0.0,0.913,0.087,0.8402,SYRX quotes & news  Google Finance,http://www.google.ca/finance?q=NASDAQ:SYRX&amp;amp;client=news-rss&amp;amp;ei=uKouVpmYH9e5jAHZ1rHgDA
SYRX,0.0,0.902,0.098,0.9893,Abnormal Volume Spikes: Tantech Holdings Ltd (NASDAQ:TANH) Sysorex Global Holdings Corp (NASDAQ:SYRX) New York & Company Inc. (NYSE:NWY),http://www.wallstreetpoint.com/abnormal-volume-spikes-tantech-holdings-ltd-nasdaqtanh-sysorex-global-holdings-corp-nasdaqsyrx-new-york-company-inc-nysenwy/7216293/
SYRX,0.026,0.769,0.205,0.9726,Sysorex Global Holdings Corp. (SYRX) IPO Opens Flat,http://www.streetinsider.com/IPOs/Sysorex+Global+Holdings+Corp.+(SYRX)+IPO+Opens+Flat/9370466.html
SYRX,0.012,0.849,0.139,0.9914,Sysorex Global Holdings Corp (NASDAQ:SYRX): How Far So Far?,http://www.usmarketsdaily.com/sysorex-global-holdings-corp-nasdaqsyrx-how-far-so-far-7705
SYRX,0.007,0.922,0.071,0.9436,Sysorex Global Holdings Corp Earns Buy Rating from Analysts at B. Riley (SYRX),http://www.dakotafinancialnews.com/sysorex-global-holdings-corp-earns-buy-rating-from-analysts-at-b-riley-syrx/482731/
SYRX,0.015,0.872,0.113,0.9884,Active Watchful Movers- Sysorex Global Holdings Corp. (NASDAQ:SYRX) SunEdison Inc. (NYSE:SUNE) Advanced Micro Devices Inc. (NASDAQ:AMD),http://www.streetwisereport.com/active-watchful-movers-sysorex-global-holdings-corp-nasdaqsyrx-sunedison-inc-nysesune-advanced-micro-devices-inc-nasdaqamd/131556/
EXLS,0.0,0.902,0.098,0.8689,EXLS quotes & news  Google Finance,http://www.google.ca/finance?q=NASDAQ:EXLS&amp;amp;client=news-rss&amp;amp;ei=r6ouVonQHISH2Aah_6noDw
EXLS,0.0,0.902,0.098,0.8689,EXLS quotes & news  Google Finance,http://www.google.ca/finance?q=NASDAQ:EXLS&amp;amp;client=news-rss&amp;amp;ei=r6ouVonQHISH2Aah_6noDw
EXLS,0.017,0.883,0.1,0.9867,Exlservice Holdings Inc. (EXLS) Discloses Form 4 Insider Selling : Exec. Vishal Chhibbar Sells 4441 Shares,http://www.americantradejournal.com/exlservice-holdings-inc-exls-discloses-form-4-insider-selling-exec-vishal-chhibbar-sells-4441-shares/6132591/
EXLS,0.006,0.899,0.096,0.979,Stock Update: ExlService Holdings Inc. (NASDAQ:EXLS),http://www.themarketsdaily.com/analyst-views/stock-update-exlservice-holdings-inc-nasdaqexls-2/74444/
EXLS,0.01,0.938,0.053,0.9259,ExlService Holdings Inc. (EXLS) Hits New 52-week High During October 16 Session,http://www.equities.com/editors-desk/stocks/market-movers/exlservice-holdings-inc-exls-hits-new-52-week-high-during-october-16-session
EXLS,0.005,0.893,0.102,0.9966,Vishal Chhibbar the EVP & CFO of ExlService Holdings Inc. (NASDAQ:EXLS) Unloaded 365 Shares of the Company,http://www.octafinance.com/vishal-chhibbar-the-evp-cfo-of-exlservice-holdings-inc-nasdaqexls-unloaded-365-shares-of-the-company/
HMNY,0.02,0.863,0.117,0.9962,Helios And Matheson Analytics: A Potential Candidate For Acquisition? - Helios & Matheson North America Inc. (NASDAQ:HMNY),http://seekingalpha.com/article/1719622-helios-and-matheson-analytics-a-potential-candidate-for-acquisition?source=feed_symbol_hmny
HMNY,0.0,0.937,0.063,0.4404,Helios and Matheson Information Technology... - Helios & Matheson North America Inc. (NASDAQ:HMNY),http://seekingalpha.com/news/801151?source=feed_symbol_hmny
HMNY,0.0,0.942,0.058,0.7003,HMNY quotes & news  Google Finance,http://www.google.ca/finance?q=NASDAQ:HMNY&amp;amp;client=news-rss&amp;amp;ei=_qouVpjBO9a_jAHqo5TIDg
HMNY,0.0,0.942,0.058,0.7003,HMNY quotes & news  Google Finance,http://www.google.ca/finance?q=NASDAQ:HMNY&amp;amp;client=news-rss&amp;amp;ei=_qouVpjBO9a_jAHqo5TIDg
HMNY,0.032,0.912,0.056,0.4215,Helios and Matheson Analytics Inc (HMNY) Ex-Dividend Date Scheduled for February 13 2014,http://www.nasdaq.com/article/helios-and-matheson-analytics-inc-hmny-exdividend-date-scheduled-for-february-13-2014-cm325877
HMNY,0.033,0.84,0.126,0.9931,Tues Morning Thoughts: Aethlon Medical Inc. (AEMD) Helios and Matheson Analytics Inc. (HMNY) American Campus Communities Inc. (ACC) The TJX Companies Inc. (TJX) Seattle Genetics Inc. (SGEN),http://www.wallstreetscope.com/tues-morning-thoughts-aethlon-medical-inc-aemd-helios-and-matheson-analytics-inc-hmny-american-campus-communities-inc-acc-the-tjx-companies-inc-tjx-seattle-genetics-inc-sgen/25433993/
HMNY,0.042,0.839,0.119,0.9901,Tuesdays Pre-Market Outlook: Pacific Drilling S.A. (PACD) PolyOne Corporation (POL) Helios and Matheson Analytics Inc. (HMNY) Apollo Global Management LLC (APO) CB Financial Services Inc. (CBFV,http://www.wallstreetscope.com/tuesdays-pre-market-outlook-pacific-drilling-s-a-pacd-polyone-corporation-pol-helios-and-matheson-analytics-inc-hmny-apollo-global-management-llc-apo-cb-financial-services-in/25409547/
HMNY,0.024,0.874,0.102,0.9973,Technology Stocks On The Lead - Benefitfocus (NASDAQ:BNFT) WaferGen Bio-systems (NASDAQ:WGBS) CollabRx (NASDAQ:CLRX) Helios and Matheson Analytics (NASDAQ:HMNY),http://www.wsnewspublishers.com/technology-stocks-on-the-lead-benefitfocus-nasdaqbnft-wafergen-bio-systems-nasdaqwgbs-collabrx-nasdaqclrx-helios-and-matheson-analytics-nasdaqhmny/151556/
HMNY,0.062,0.827,0.111,0.9808,Wednesday Pre-Market Thoughts: Stanley Black & Decker Inc. (SWK) EchoStar Corp. (SATS) Groupon Inc. (GRPN) ACE Limited (ACE) Helios and Matheson Analytics Inc. (HMNY),http://www.wallstreetscope.com/wednesday-pre-market-thoughts-stanley-black-decker-inc-swk-echostar-corp-sats-groupon-inc-grpn-ace-limited-ace-helios-and-matheson-analytics-inc-hmny/25444557/
BNFT,0.0,0.899,0.101,0.875,Benefitfocus +31.9% on Q4 beat Mercer investment - Benefitfocus Inc. (NASDAQ:BNFT),http://seekingalpha.com/news/2322846-benefitfocus-plus-31_9-percent-on-q4-beat-mercer-investment?source=feed_symbol_bnft
BNFT,0.019,0.769,0.212,0.9994,Looking for a Top Momentum Stock? 3 Reasons Why Benefitfocus (BNFT) is a Great Choice,http://us.rd.yahoo.com/finance/news/rss/story/*http://finance.yahoo.com/news/looking-top-momentum-stock-3-124512573.html
BNFT,0.0,0.886,0.114,0.9118,BNFT quotes & news  Google Finance,http://www.google.ca/finance?q=NASDAQ:BNFT&amp;amp;client=news-rss&amp;amp;ei=BKsuVoH0A9iYjAHjhr74Aw
BNFT,0.0,0.886,0.114,0.9118,BNFT quotes & news  Google Finance,http://www.google.ca/finance?q=NASDAQ:BNFT&amp;amp;client=news-rss&amp;amp;ei=BKsuVoH0A9iYjAHjhr74Aw
BNFT,0.018,0.853,0.129,0.9988,The Insider Joseph Disabato Sold 2283095 shares of Benefitfocus Inc (NASDAQ:BNFT),http://www.octafinance.com/the-insider-joseph-disabato-sold-2283095-shares-of-benefitfocus-inc-nasdaqbnft/
BNFT,0.014,0.943,0.043,0.7506,Notable Session Mover: Benefitfocus Inc. (NASDAQ:BNFT),http://www.vanguardtribune.com/2015/10/21/notable-session-mover-benefitfocus-inc-nasdaqbnft-5/52316/
BNFT,0.021,0.851,0.127,0.9932,Benefitfocus Inc. (NASDAQ:BNFT),http://www.investornewswire.com/analyst-views/quarterly-earnings-watch-benefitfocus-inc-nasdaqbnft/46960/
EDGW,0.043,0.778,0.179,0.9983,A Look At Edgewater Technology - Edgewater Technology Inc. (NASDAQ:EDGW),http://seekingalpha.com/article/2795095-a-look-at-edgewater-technology?source=feed_symbol_edgw
EDGW,0.052,0.849,0.099,0.981,Did Christmas Come Early For The Senior Management Of Edgewater Technology? - Edgewater Technology Inc. (NASDAQ:EDGW),http://seekingalpha.com/article/1904871-did-christmas-come-early-for-the-senior-management-of-edgewater-technology?source=feed_symbol_edgw
EDGW,0.0,0.859,0.141,0.9432,EDGW quotes & news  Google Finance,http://www.google.ca/finance?q=NASDAQ:EDGW&amp;amp;client=news-rss&amp;amp;ei=EKsuVqnjIIWh2AaKsJlA
EDGW,0.0,0.859,0.141,0.9432,EDGW quotes & news  Google Finance,http://www.google.ca/finance?q=NASDAQ:EDGW&amp;amp;client=news-rss&amp;amp;ei=EKsuVqnjIIWh2AaKsJlA
EDGW,0.04,0.861,0.099,0.9825,What to know for Monday: VirnetX Holding Corp (VHC) Edgewater Technology Inc. (EDGW) iCAD Inc. (ICAD) Enterprise Financial Services Corp. (EFSC) Adobe Systems Incorporated (ADBE),http://www.wallstreetscope.com/what-to-know-for-monday-virnetx-holding-corp-vhc-edgewater-technology-inc-edgw-icad-inc-icad-enterprise-financial-services-corp-efsc-adobe-systems-incorporated-adbe/25476263/
EDGW,0.043,0.778,0.179,0.9983,A Look At Edgewater Technology - Edgewater Technology Inc. (NASDAQ:EDGW),http://seekingalpha.com/article/2795095-a-look-at-edgewater-technology
EDGW,0.035,0.868,0.097,0.9569,Clear Channel Outdoor Holdings Inc. (CCO) Tennant Company (TNC) Edgewater Technology Inc. (EDGW) Layne Christensen Company (LAYN): GAMCO Investors October Moves,http://www.insidermonkey.com/blog/clear-channel-outdoor-holdings-inc-cco-tennant-company-tnc-edgewater-technology-inc-edgw-layne-christensen-company-layn-gamco-investors-october-moves-330632/
EDGW,0.083,0.814,0.103,0.9697,Would You Vote For The Directors Of Edgewater Technology? - Edgewater Technology Inc. (NASDAQ:EDGW),http://seekingalpha.com/article/1750862-would-you-vote-for-the-directors-of-edgewater-technology
PRFT,0.0,0.94,0.06,0.4588,Perficient buying IT consulting firm for $5.3M+ - Perficient Inc. (NASDAQ:PRFT),http://seekingalpha.com/news/2786526-perficient-buying-it-consulting-firm-for-5_3m?source=feed_symbol_prft
PRFT,0.08,0.788,0.132,0.9837,Perficient: Best In Breed At A Discount - Perficient Inc. (NASDAQ:PRFT),http://seekingalpha.com/article/3339755-perficient-best-in-breed-at-a-discount?source=feed_symbol_prft
PRFT,0.098,0.86,0.042,-0.5106,Perficient -13.2% on Q2/2015 warning - Perficient Inc. (NASDAQ:PRFT),http://seekingalpha.com/news/2617775-perficient-minus-13_2-percent-on-q2-2015-warning?source=feed_symbol_prft
PRFT,0.0,0.911,0.089,0.8074,PRFT quotes & news  Google Finance,http://www.google.ca/finance?q=NASDAQ:PRFT&amp;amp;client=news-rss&amp;amp;ei=JasuVpnlL9e5jAHZ1rHgDA
PRFT,0.0,0.911,0.089,0.8074,PRFT quotes & news  Google Finance,http://www.google.ca/finance?q=NASDAQ:PRFT&amp;amp;client=news-rss&amp;amp;ei=JasuVpnlL9e5jAHZ1rHgDA
PRFT,0.021,0.907,0.072,0.8934,Perficient Inc. (PRFT) Prelim. Q2 Revenue Misses Expectations,http://www.streetinsider.com/Corporate+News/Perficient,+Inc.+(PRFT)+Prelim.+Q2+Revenue+Misses+Expectations/10709108.html
PRFT,0.0,0.808,0.192,0.998,Perficient Inc. (PRFT) to Acquire Zeon Solutions,http://www.streetinsider.com/Corporate+News/Perficient,+Inc.+(PRFT)+to+Acquire+Zeon+Solutions/10110389.html
PRFT,0.022,0.824,0.154,0.996,Company Shares of Perficient Inc. (NASDAQ:PRFT) Rally 0.91%,http://newswatchinternational.com/news/company-shares-of-perficient-inc-nasdaqprft-rally-0-91.html
PRFT,0.032,0.86,0.108,0.9855,Company Shares of Perficient Inc. (NASDAQ:PRFT) Drops by -3.14%,http://www.americantradejournal.com/company-shares-of-perficient-inc-nasdaqprft-drops-by-3-14/680538/
CLGX,0.038,0.884,0.078,0.9692,CoreLogic: Strong Results Likely To Continue Moderate Upside Potential - CoreLogic INC. (NYSE:CLGX),http://seekingalpha.com/article/3242096-corelogic-strong-results-likely-to-continue-moderate-upside-potential?source=feed_symbol_clgx
CLGX,0.057,0.814,0.129,0.9983,CoreLogic: An Exceptional Business With Significant Upside - CoreLogic INC. (NYSE:CLGX),http://seekingalpha.com/article/3056956-corelogic-an-exceptional-business-with-significant-upside?source=feed_symbol_clgx
CLGX,0.026,0.826,0.148,0.9998,Comparing The 2 Largest Processing Systems And Products Companies - CoreLogic INC. (NYSE:CLGX),http://seekingalpha.com/article/2780865-comparing-the-2-largest-processing-systems-and-products-companies?source=feed_symbol_clgx
CLGX,0.074,0.784,0.142,0.7269,More on CoreLogic Q3 results - CoreLogic INC. (NYSE:CLGX),http://seekingalpha.com/news/2051095-more-on-corelogic-q3-results?source=feed_symbol_clgx
CLGX,0.031,0.884,0.085,0.9774,Mortgage-Related Stocks: Is The Smart Money Buying? CLGX TREE,http://us.rd.yahoo.com/finance/external/investors/rss/SIG=121uhaaag/*http://news.investors.com/101615-776042-top-mortgage-stocks.htm?ven=yahoocp&amp;src=aurlled&amp;ven=yahoo
CLGX,0.079,0.801,0.119,0.3182,CLGX quotes & news  Google Finance,http://www.google.ca/finance?q=NYSE:CLGX&amp;amp;client=news-rss&amp;amp;ei=bKsuVtmkBoffjAGM8aj4DA
CLGX,0.079,0.801,0.119,0.3182,CLGX quotes & news  Google Finance,http://www.google.ca/finance?q=NYSE:CLGX&amp;amp;client=news-rss&amp;amp;ei=bKsuVtmkBoffjAGM8aj4DA
CLGX,0.008,0.901,0.091,0.9895,CoreLogic Inc (NYSE:CLGX) Had Its Target Price Raises by Equity Analysts at KBW to $42.50,http://www.octafinance.com/corelogic-inc-nyseclgx-had-its-target-price-raises-by-equity-analysts-at-kbw-to-42-50/239925/
CLGX,0.017,0.893,0.09,0.981,Fundamental and Technical Insights on CoreLogic Inc (NYSE:CLGX),http://www.streetreport.co/fundamental-and-technical-insights-on-corelogic-inc-nyseclgx-2/26429/
CLGX,0.026,0.896,0.078,0.9477,CoreLogic Inc. (NYSE:CLGX) Given $42.5 Consensus PT,http://www.themarketsdaily.com/analyst-actions/corelogic-inc-nyseclgx-given-42-5-consensus-pt/74569/
CLGX,0.025,0.843,0.132,0.9945,Analyst Price Target Update on CoreLogic Inc. (NYSE:CLGX),http://newswatchinternational.com/news/analyst-price-target-update-on-corelogic-inc-nyseclgx.html
