Ticker,neg,neu,pos,compound,Title,url
CLGX,0.045,0.85,0.105,0.9792,Shares of CoreLogic Inc. (NYSE:CLGX) Sees Large Outflow of Money,http://newswatchinternational.com/news/shares-of-corelogic-inc-nyseclgx-sees-large-outflow-of-money.html
CLGX,0.014,0.879,0.108,0.9973,Technology Watch list: Corelogic Inc (NYSE:CLGX) Fitbit Inc (NYSE:FIT) Advanced Micro Devices Inc. (NASDAQ:AMD),http://www.newsoracle.com/technology-watch-list-corelogic-inc-nyseclgx-fitbit-inc-nysefit-advanced-micro-devices-inc-nasdaqamd/9769/
CLGX,0.033,0.866,0.1,0.981,Company Shares of CoreLogic Inc. (NYSE:CLGX) Rally 4.3%,http://www.americantradejournal.com/company-shares-of-corelogic-inc-nyseclgx-rally-4-3/6128836/
TDC,0.072,0.823,0.105,0.3182,Teradata adds $500M to buyback; shares rise - Teradata Corporation (NYSE:TDC),http://seekingalpha.com/news/2740056-teradata-adds-500m-to-buyback-shares-rise?source=feed_symbol_tdc
TDC,0.082,0.905,0.012,-0.9153,Teradata down 15.7% on Q2 miss guidance cut; product revenue drops 15% - Teradata Corporation (NYSE:TDC),http://seekingalpha.com/news/2704836-teradata-down-15_7-percent-on-q2-miss-guidance-cut-product-revenue-drops-15-percent?source=feed_symbol_tdc
TDC,0.069,0.81,0.12,0.4985,Teradata -4.1%; JMP downgrades on competitive fears - Teradata Corporation (NYSE:TDC),http://seekingalpha.com/news/2580075-teradata-minus-4_1-percent-jmp-downgrades-on-competitive-fears?source=feed_symbol_tdc
TDC,0.046,0.726,0.228,0.9995,Teradata Corporation Is A Great Company At A Fair Price - Teradata Corporation (NYSE:TDC),http://seekingalpha.com/article/3240346-teradata-corporation-is-a-great-company-at-a-fair-price?source=feed_symbol_tdc
TDC,0.059,0.903,0.038,-0.5719,Teradata -8% on Q1 miss light EPS guidance; $300M added to buyback - Teradata Corporation (NYSE:TDC),http://seekingalpha.com/news/2501826-teradata-minus-8-percent-on-q1-miss-light-eps-guidance-300m-added-to-buyback?source=feed_symbol_tdc
TDC,0.026,0.903,0.071,0.8271,Teradata's R&D chief leaves to become Hortonworks' CTO - Teradata Corporation (NYSE:TDC),http://seekingalpha.com/news/2426216-teradatas-r-and-d-chief-leaves-to-become-hortonworks-cto?source=feed_symbol_tdc
TDC,0.033,0.92,0.047,0.3182,Teradata restructures appoints co-presidents - Teradata Corporation (NYSE:TDC),http://seekingalpha.com/news/2330466-teradata-restructures-appoints-co-presidents?source=feed_symbol_tdc
TDC,0.054,0.895,0.05,-0.1796,Teradata -10.6% on revenue miss soft 2015 guidance - Teradata Corporation (NYSE:TDC),http://seekingalpha.com/news/2277436-teradata-minus-10_6-percent-on-revenue-miss-soft-2015-guidance?source=feed_symbol_tdc
TDC,0.007,0.821,0.172,0.9993,Recent Acquisitions Increased Buybacks Make Teradata An Excellent Watch List Addition - Teradata Corporation (NYSE:TDC),http://seekingalpha.com/article/2787875-recent-acquisitions-increased-buybacks-make-teradata-an-excellent-watch-list-addition?source=feed_symbol_tdc
TDC,0.0,0.951,0.049,0.6597,TDC quotes & news  Google Finance,http://www.google.ca/finance?q=NYSE:TDC&amp;amp;client=news-rss&amp;amp;ei=c6suVqDaFte5jAHZ1rHgDA
TDC,0.0,0.951,0.049,0.6597,TDC quotes & news  Google Finance,http://www.google.ca/finance?q=NYSE:TDC&amp;amp;client=news-rss&amp;amp;ei=c6suVqDaFte5jAHZ1rHgDA
TDC,0.018,0.859,0.122,0.9921,Zacks Short Term Rating on Teradata Corporation (NYSE:TDC),http://www.americantradejournal.com/zacks-short-term-rating-on-teradata-corporation-nysetdc/6130702/
TDC,0.035,0.856,0.109,0.9818,Company Shares of Teradata Corporation (NYSE:TDC) Drops by -3.02%,http://newswatchinternational.com/news/company-shares-of-teradata-corporation-nysetdc-drops-by-3-02.html
TDC,0.018,0.848,0.135,0.9931,Teradata Corporation (NYSE:TDC) Short Interest Update,http://newswatchinternational.com/news/teradata-corporation-nysetdc-short-interest-update-2.html
TDC,0.055,0.903,0.042,-0.8484,Notable Stocks on the Move: Teradata Corporation (NYSE:TDC) XL Group plc (NYSE:XL) Qlik Technologies Inc (NASDAQ:QLIK),http://www.wsnewspublishers.com/notable-stocks-on-the-move-teradata-corporation-nysetdc-xl-group-plc-nysexl-qlik-technologies-inc-nasdaqqlik/1536193/
WIT,0.012,0.978,0.011,-0.0516,Cognizant up 8.8% on Q2 beat solid guidance; INFY WIT also higher - Cognizant Technology Solutions Corporation (NASDAQ:CTSH),http://seekingalpha.com/news/2696095-cognizant-up-8_8-percent-on-q2-beat-solid-guidance-infy-wit-also-higher?source=feed_symbol_wit
WIT,0.102,0.84,0.058,-0.6486,Infosys up 10.8% on results/guidance; CTSH WIT also higher - Infosys Limited Inc. (NYSE:INFY),http://seekingalpha.com/news/2641715-infosys-up-10_8-percent-on-results-guidance-ctsh-wit-also-higher?source=feed_symbol_wit
WIT,0.0,0.975,0.025,0.3182,Reports: Wipro in talks to buy U.K. BPO firm potentially for ~1B - Wipro Limited (NYSE:WIT),http://seekingalpha.com/news/2580505-reports-wipro-in-talks-to-buy-u-k-bpo-firm-potentially-for-1b?source=feed_symbol_wit
WIT,0.0,0.921,0.079,0.6597,Wipro appoints COO - Wipro Limited (NYSE:WIT),http://seekingalpha.com/news/2370766-wipro-appoints-coo?source=feed_symbol_wit
WIT,0.036,0.76,0.204,0.999,Update: Wipro Q3 Earnings - Wipro Limited (NYSE:WIT),http://seekingalpha.com/article/2828956-update-wipro-q3-earnings?source=feed_symbol_wit
WIT,0.016,0.893,0.091,0.9886,Wipro's Shares Jump 9.58% Following Its Strong Q3 Earnings Report - Should You Be A Buyer? - Wipro Limited (NYSE:WIT),http://seekingalpha.com/article/2830036-wipros-shares-jump-9_58-percent-following-its-strong-q3-earnings-report-should-you-be-a-buyer?source=feed_symbol_wit
WIT,0.04,0.921,0.04,-0.0027,Wipro up 6.2% on results/guidance; CFO to retire - Wipro Limited (NYSE:WIT),http://seekingalpha.com/news/2227396-wipro-up-6_2-percent-on-results-guidance-cfo-to-retire?source=feed_symbol_wit
WIT,0.015,0.943,0.042,0.5106,WIT quotes & news  Google Finance,http://www.google.ca/finance?q=NYSE:WIT&amp;amp;client=news-rss&amp;amp;ei=gKsuVvOoAo3ZjAHJ9ZToBA
WIT,0.015,0.943,0.042,0.5106,WIT quotes & news  Google Finance,http://www.google.ca/finance?q=NYSE:WIT&amp;amp;client=news-rss&amp;amp;ei=gKsuVvOoAo3ZjAHJ9ZToBA
WIT,0.037,0.888,0.075,0.8286,Analysis and Wipro Limited (ADR) (WIT) Earnings Review,http://www.octafinance.com/analysis-and-wipro-limited-adr-wit-earnings-review/
WIT,0.0,0.78,0.22,0.9899,WIT: WIPRO LTD-ADR Stock Quote & Analysis,http://www.zacks.com/stock/quote/WIT
WIT,0.032,0.914,0.055,0.8126,Asian Stocks for Investors: Tata Motors Limited (ADR) (NYSE:TTM) Wipro Limited (ADR) (NYSE:WIT) Mitsubishi UFJ Financial Group Inc (ADR) (NYSE:MTU),http://www.newsoracle.com/asian-stocks-for-investors-tata-motors-limited-adr-nysettm-wipro-limited-adr-nysewit-mitsubishi-ufj-financial-group-inc-adr-nysemtu/4409/
WIT,0.037,0.905,0.057,0.8403,Hedge Funds Are Buying Wipro Limited (ADR) (WIT),http://www.insidermonkey.com/blog/hedge-funds-are-buying-wipro-limited-adr-wit-182451/
WIT,0.041,0.916,0.043,0.3567,Wipro Limited (ADR) (WIT): Do Hedge Funds and Insiders Love This Stock,http://www.insidermonkey.com/blog/wipro-limited-adr-wit-do-hedge-funds-and-insiders-love-this-stock-102664/
WIT,0.0,0.87,0.13,0.6908,WIT) will Announce Q2 Results at 21st October,http://www.marketswired.com/wipro-ltd-adr-nysewit-will-announce-q2-results-at-21st-october/228844/
WIT,0.056,0.875,0.069,0.8331,Wipro Limited Rating Increased to Hold at Zacks (WIT),http://www.dakotafinancialnews.com/wipro-limited-rating-increased-to-hold-at-zacks-wit/448846/
WIT,0.056,0.876,0.069,0.8331,Wipro Limited Lifted to Hold at Zacks (WIT),http://www.dakotafinancialnews.com/wipro-limited-lifted-to-hold-at-zacks-wit/427812/
WIT,0.025,0.907,0.068,0.9334,Three Top Asian Stocks: Wipro Limited (NYSE:WIT) United Microelectronics Corp (NYSE:UMC) China Mobile Ltd. (NYSE:CHL),http://www.newsoracle.com/three-top-asian-stocks-wipro-limited-nysewit-united-microelectronics-corp-nyseumc-china-mobile-ltd-nysechl/6858/
G,0.098,0.797,0.105,0.8979,Dismal Year For Gold Stocks May Present Opportunity For Patient Investors,http://seekingalpha.com/article/2660655-dismal-year-for-gold-stocks-may-present-opportunity-for-patient-investors?source=feed_symbol_g
G,0.06,0.826,0.115,0.9927,Gold The Fed And And The Inflation Shuffle,http://seekingalpha.com/article/2424215-gold-the-fed-and-and-the-inflation-shuffle?source=feed_symbol_g
G,0.0,0.854,0.146,0.7579,Q2 2014 Genpact Ltd Earnings Conference Call (Webcast),http://seekingalpha.com/article/2363895-q2-2014-genpact-ltd-earnings-conference-call-webcast?source=feed_symbol_g
G,0.029,0.971,0.0,-0.2942,Genpact Limited Common Stock Stock - Yahoo! Finance,http://finance.yahoo.com/q/h?s=g
G,0.029,0.971,0.0,-0.2942,Genpact Limited Common Stock Stock - Yahoo! Finance,http://finance.yahoo.com/q/h?s=g
G,0.102,0.898,0.0,-0.9001,Glencore to re-open Canadian nickel mine after fatality,http://us.rd.yahoo.com/finance/news/rss/story/*http://uk.finance.yahoo.com/news/glencore-open-canadian-nickel-mine-191241761.html
G,0.11,0.89,0.0,-0.9001,Glencore to re-open Canadian nickel mine after fatality,http://us.rd.yahoo.com/finance/news/rss/story/*http://finance.yahoo.com/news/glencore-open-canadian-nickel-mine-191241823.html
G,0.052,0.788,0.16,0.9986,Genpact Lean Digital(SM) Automation Solution Rearchitects Finance and Accounting Processes,http://us.rd.yahoo.com/finance/external/noodlsaunz/rss/SIG=1253qpqj6/*http://www.noodls.com/view/4C1AB0098056E45327CC65D07011781BB3616A92
G,0.051,0.79,0.16,0.9987,Genpact Lean Digital(SM) Automation Solution Rearchitects Finance and Accounting Processes,http://us.rd.yahoo.com/finance/news/rss/story/*http://finance.yahoo.com/news/genpact-lean-digital-sm-automation-140000247.html
G,0.013,0.847,0.14,0.9978,Genpact Named Leader in Global Banking Business Process Outsourcing by Everest Group,http://us.rd.yahoo.com/finance/external/noodlsaunz/rss/SIG=125ub0p9u/*http://www.noodls.com/view/0DD06F094F8CE46D0202FBB9C8F289A6E676809E
G,0.013,0.852,0.136,0.9978,Genpact Named Leader in Global Banking Business Process Outsourcing by Everest Group,http://us.rd.yahoo.com/finance/news/rss/story/*http://finance.yahoo.com/news/genpact-named-leader-global-banking-120000310.html
G,0.004,0.931,0.065,0.959,Genpact Schedules Earnings Announcement and Conference Call for Third Quarter 2015,http://us.rd.yahoo.com/finance/external/noodlsaunz/rss/SIG=125cieqm0/*http://www.noodls.com/view/74894F7A0D401CBFBAE8D4174B752382AD6024C8
G,0.003,0.933,0.064,0.959,Genpact Schedules Earnings Announcement and Conference Call for Third Quarter 2015,http://us.rd.yahoo.com/finance/news/rss/story/*http://finance.yahoo.com/news/genpact-schedules-earnings-announcement-conference-140000928.html
G,0.027,0.83,0.143,0.9982,Genpact Limited (via noodls) / Next Generation Cloud-Based Automation Solution Helps CFOs Rearchitect Finance Operations via Genpact's Lean Digital(SM) Approach,http://us.rd.yahoo.com/finance/external/noodlsaunz/rss/SIG=125k4lqlt/*http://www.noodls.com/view/C2A4B202940DB1EF3931DDB66AD9AB4AFC34ECB6
G,0.026,0.832,0.142,0.9984,Next Generation Cloud-Based Automation Solution Helps CFOs Rearchitect Finance Operations via Genpact's Lean Digital(SM) Approach,http://us.rd.yahoo.com/finance/news/rss/story/*http://finance.yahoo.com/news/next-generation-cloud-based-automation-120000168.html
G,0.003,0.719,0.278,0.9998,Building Talent in the Age of Increasing Automation: Genpact Wins 11 Brandon Hall Group Excellence Awards,http://us.rd.yahoo.com/finance/external/noodlsaunz/rss/SIG=125j3lapi/*http://www.noodls.com/view/41A785C8FD4DCBDEA63192ED069CB6832ACAC8BB
G,0.003,0.725,0.272,0.9998,Building Talent in the Age of Increasing Automation: Genpact Wins 11 Brandon Hall Group Excellence Awards,http://us.rd.yahoo.com/finance/news/rss/story/*http://finance.yahoo.com/news/building-talent-age-increasing-automation-120000858.html
G,0.033,0.9,0.068,0.9153,ETF's with exposure to Genpact Ltd. : October 1 2015,http://us.rd.yahoo.com/finance/external/xcapitalcube/rss/SIG=12tjf03dn/*http://www.capitalcube.com/blog/index.php/etfs-with-exposure-to-genpact-ltd-october-1-2015/
G,0.028,0.86,0.113,0.9952,Genpact to Acquire Mobile Digital Solutions Provider Endeavour to Enhance Digital Transformation Capabilities,http://us.rd.yahoo.com/finance/external/noodlsaunz/rss/SIG=1255r2jck/*http://www.noodls.com/view/AD2733CBDF42F347FD5410C2C1001DDA2EB4DE71
G,0.028,0.861,0.111,0.9949,Genpact to Acquire Mobile Digital Solutions Provider Endeavour to Enhance Digital Transformation Capabilities,http://us.rd.yahoo.com/finance/news/rss/story/*http://finance.yahoo.com/news/genpact-acquire-mobile-digital-solutions-134500994.html
G,0.007,0.85,0.143,0.9972,Genpact Joins GE's Predix Early Adopter Program to Help Companies Harness Industrial Internet,http://us.rd.yahoo.com/finance/external/noodlsaunz/rss/SIG=125gqe0jd/*http://www.noodls.com/view/772B74EF7D81D0998DFAC72ED0A8ACFD8E64FB3B
G,0.006,0.856,0.137,0.9972,Genpact Joins GE's Predix Early Adopter Program to Help Companies Harness Industrial Internet,http://us.rd.yahoo.com/finance/news/rss/story/*http://finance.yahoo.com/news/genpact-joins-ges-predix-early-200000528.html
G,0.0,0.841,0.159,0.9246,G quotes & news  Google Finance,http://www.google.ca/finance?q=TSE:G&amp;amp;client=news-rss&amp;amp;ei=0KsuVumhIdCT2Aa2kqK4Bw
G,0.0,0.841,0.159,0.9246,G quotes & news  Google Finance,http://www.google.ca/finance?q=TSE:G&amp;amp;client=news-rss&amp;amp;ei=0KsuVumhIdCT2Aa2kqK4Bw
G,0.011,0.867,0.122,0.9942,Should Bullion Investors Buy Goldcorp Inc. (USA) or Agnico Eagle Mines Ltd. (USA)?,http://www.fool.ca/2015/10/22/should-bullion-investors-buy-goldcorp-inc-or-agnico-eagle-mines-ltd/
G,0.074,0.788,0.137,0.9895,Barrick Gold Corp. (USA) or Goldcorp Inc. (USA): Which Is the Safer Turnaround Stock?,https://www.fool.ca/2015/09/29/barrick-gold-corp-or-goldcorp-inc-which-is-the-safer-turnaround-stock/
G,0.099,0.79,0.111,0.8245,Has Goldcorp Inc. (USA) Finally Bottomed Out?,https://www.fool.ca/2015/10/06/has-goldcorp-inc-finally-bottomed-out/
G,0.042,0.839,0.119,0.9896,Should You Buy Barrick Gold Corp. (USA) or Goldcorp Inc. (USA)?,http://www.fool.ca/2015/10/02/should-you-buy-barrick-gold-corp-or-goldcorp-inc/
G,0.058,0.782,0.159,0.9958,Is Goldcorp Inc. (USA) or Barrick Gold Corp. (USA) a Better Way to Play a Bullion Surge?,http://www.fool.ca/2015/10/14/is-goldcorp-inc-or-barrick-gold-corp-a-better-way-to-play-a-bullion-surge/
G,0.004,0.907,0.088,0.9872,GG) Ratings and Sentiment Update,http://www.investornewswire.com/analyst-views/goldcorp-inc-nysegg-ratings-and-sentiment-update/53946/
G,0.013,0.866,0.121,0.9918,Analyst Price Target Update on Goldcorp Inc. (NYSE,http://www.moneyflowindex.org/analyst-price-target-update-on-goldcorp-inc-nysegg/3172990/
G,0.047,0.872,0.081,0.9217,Top Canada Stock Picking: Goldcorp Inc. (USA) (NYSE:GG) Teck Resources Ltd (USA)(NYSE:TCK) Lululemon Athletica inc. (NASDAQ:LULU),http://www.wallstreetpoint.com/top-canada-stock-picking-goldcorp-inc-usa-nysegg-teck-resources-ltd-usanysetck-lululemon-athletica-inc-nasdaqlulu/7219057/
NRCIB,0.006,0.824,0.17,0.9962,National Research Corporation: Confirming A Major Valuation Discrepancy - National Research Corporation (NASDAQ:NRCIB),http://seekingalpha.com/article/2813765-national-research-corporation-confirming-a-major-valuation-discrepancy?source=feed_symbol_nrcib
NRCIB,0.032,0.916,0.052,0.3182,National Research Corp: Research That Pays - National Research Corporation (NASDAQ:NRCIB),http://seekingalpha.com/article/1829962-national-research-corp-research-that-pays?source=feed_symbol_nrcib
NRCIB,0.032,0.819,0.149,0.9957,WallStreet Morning Ratings: National Research Corp. (NRCIB) ABM Industries Incorporated (ABM) Globe Specialty Metals Inc. (GSM) Progress Software Corporation (PRGS) Landmark Bancorp Inc. (LARK),http://www.wallstreetscope.com/wallstreet-morning-ratings-national-research-corp-nrcib-abm-industries-incorporated-abm-globe-specialty-metals-inc-gsm-progress-software-corporation-prgs-landmark-bancorp-inc-lark/25446391/
CMCM,0.027,0.845,0.128,0.9981,Qihoo 360 & Cheetah Mobile: The Inherent Disadvantages Of Utility Apps - Cheetah Mobile Inc. (NYSE:CMCM),http://seekingalpha.com/article/3603366-qihoo-360-and-cheetah-mobile-the-inherent-disadvantages-of-utility-apps?source=feed_symbol_cmcm
CMCM,0.067,0.82,0.114,0.993,Has Cheetah Bottomed? - Cheetah Mobile Inc. (NYSE:CMCM),http://seekingalpha.com/article/3582396-has-cheetah-bottomed?source=feed_symbol_cmcm
CMCM,0.136,0.673,0.191,0.9923,Placebo Effects And Cheetah Mobile's Price Optimism - Cheetah Mobile Inc. (NYSE:CMCM),http://seekingalpha.com/article/3558016-placebo-effects-and-cheetah-mobiles-price-optimism?source=feed_symbol_cmcm
CMCM,0.032,0.857,0.111,0.9839,Cheetah Mobile: Keeping Expectations In Check - Cheetah Mobile Inc. (NYSE:CMCM),http://seekingalpha.com/article/3451516-cheetah-mobile-keeping-expectations-in-check?source=feed_symbol_cmcm
CMCM,0.038,0.871,0.091,0.8588,Cheetah Mobile slumps in spite of Q2 beat strong Q3 guidance - Cheetah Mobile Inc. (NYSE:CMCM),http://seekingalpha.com/news/2734466-cheetah-mobile-slumps-in-spite-of-q2-beat-strong-q3-guidance?source=feed_symbol_cmcm
CMCM,0.009,0.838,0.153,0.9969,Cheetah Mobile: Is Ad Tech The Future Of This Company? - Cheetah Mobile Inc. (NYSE:CMCM),http://seekingalpha.com/article/3357335-cheetah-mobile-is-ad-tech-the-future-of-this-company?source=feed_symbol_cmcm
CMCM,0.013,0.858,0.129,0.8779,Cheetah Mobile expands Tencent alliance; shares +5.4% - Cheetah Mobile Inc. (NYSE:CMCM),http://seekingalpha.com/news/2606475-cheetah-mobile-expands-tencent-alliance-shares-plus-5_4-percent?source=feed_symbol_cmcm
CMCM,0.0,0.983,0.017,0.34,Major tech decliners: ROVI MXWL WATT KEYW RBCN CMCM WAVX - Rovi Corporation (NASDAQ:ROVI),http://seekingalpha.com/news/2605325-major-tech-decliners-rovi-mxwl-watt-keyw-rbcn-cmcm-wavx?source=feed_symbol_cmcm
CMCM,0.009,0.822,0.169,0.999,Cheetah Mobile: An Undervalued Mobile Company With Great Opportunities - Cheetah Mobile Inc. (NYSE:CMCM),http://seekingalpha.com/article/3286665-cheetah-mobile-an-undervalued-mobile-company-with-great-opportunities?source=feed_symbol_cmcm
CMCM,0.045,0.853,0.102,0.9987,Why I Held On To Cheetah Mobile And How It Paid Off - Cheetah Mobile Inc. (NYSE:CMCM),http://seekingalpha.com/article/3274275-why-i-held-on-to-cheetah-mobile-and-how-it-paid-off?source=feed_symbol_cmcm
CMCM,0.059,0.873,0.068,0.7587,Cheetah Mobile (CMCM): Moving Average Crossover Alert,http://us.rd.yahoo.com/finance/news/rss/story/*http://finance.yahoo.com/news/cheetah-mobile-cmcm-moving-average-091209832.html
CMCM,0.016,0.896,0.087,0.9606,Devalued Yuan Hits Big Q2 Earner Cheetah Mobile Hard CMCM,http://us.rd.yahoo.com/finance/external/investors/rss/SIG=12fl6iblp/*http://news.investors.com/081815-767044-cheetah-mobile-beats-q2-estimates.htm?ven=yahoocp&amp;src=aurlled&amp;ven=yahoo
CMCM,0.06,0.795,0.145,0.9621,Cheetah Mobile (CMCM) Stock Climbs in Pre-Market Trading on Strong Earnings Beat,http://us.rd.yahoo.com/finance/external/tsmfe/rss/SIG=13vrb32tn/*http://www.thestreet.com/story/13258835/1/cheetah-mobile-cmcm-stock-climbs-in-pre-market-trading-on-strong-earnings-beat.html?puc=yahoo&amp;cm_ven=YAHOO
CMCM,0.035,0.888,0.077,0.6705,CMCM quotes & news  Google Finance,http://www.google.ca/finance?q=NYSE:CMCM&amp;amp;client=news-rss&amp;amp;ei=76suVunUEJWOjAHVq5KADA
CMCM,0.035,0.888,0.077,0.6705,CMCM quotes & news  Google Finance,http://www.google.ca/finance?q=NYSE:CMCM&amp;amp;client=news-rss&amp;amp;ei=76suVunUEJWOjAHVq5KADA
CMCM,0.0,0.89,0.11,0.9934,Oversold Stocks To Watch: Cheetah Mobile Inc (ADR) (NYSE:CMCM) Alliance Resource Partners LP (NASDAQ:ARLP) Tumi Holdings Inc (NYSE:TUMI),http://www.streetreport.co/oversold-stocks-to-watch-cheetah-mobile-inc-adr-nysecmcm-alliance-resource-partners-lp-nasdaqarlp-tumi-holdings-inc-nysetumi/24141/
CMCM,0.018,0.813,0.169,0.9973,CMCM) Starts New Campaign to Save Our Wildlife,http://www.streetreport.co/cheetah-mobile-inc-adr-nysecmcm-starts-new-campaign-to-save-our-wildlife/21998/
CMCM,0.087,0.836,0.077,-0.0217,Why Hecla Mining Company (NYSE:HL) Cheetah Mobile Inc (ADR) (NYSE:CMCM) and TRACON Pharmaceuticals Inc (NASDAQ:TCON) Are 3 of Today's Best Stocks,http://investorplace.com/2015/09/hecla-mining-company-hl-cheetah-mobile-inc-adr-cmcm-tracon-pharmaceuticals-inc-tcon-3-todays-best-stocks/
CMCM,0.036,0.901,0.062,0.8225,Asian Stocks Overview: Infosys Ltd ADR(NYSE:INFY) Cheetah Mobile Inc (ADR)(NYSE:CMCM) Vipshop Holdings Ltd  ADR(NYSE:VIPS),http://www.newsoracle.com/asian-stocks-overview-infosys-ltd-adrnyseinfy-cheetah-mobile-inc-adrnysecmcm-vipshop-holdings-ltd-adrnysevips/2979/
CMCM,0.005,0.807,0.188,0.9956,Cheetah Mobile Inc (ADR) (CMCM) IPO Off And Running,http://www.valuewalk.com/2014/05/cheetah-mobile-inc-cmcm-ipo-off-and-running/
CMCM,0.061,0.854,0.084,0.9247,China Stocks Rises: Cheetah Mobile Inc (ADR) (CMCM) 58.com Inc (ADR) (WUBA) Jumei International Holding Ltd (JMEI),http://www.wsobserver.com/china-stocks-rises-cheetah-mobile-inc-adr-cmcm-58-com-inc-adr-wuba-jumei-international-holding-ltd-jmei/7236347/
MSCI,0.049,0.747,0.204,0.9993,MSCI Doesn't Only Create Interesting ETFs It Could Also Be An Interesting Investment - MSCI Inc. (NYSE:MSCI),http://seekingalpha.com/article/3517996-msci-doesnt-only-create-interesting-etfs-it-could-also-be-an-interesting-investment?source=feed_symbol_msci
MSCI,0.0,0.984,0.016,0.0772,MSCI debuts Saudi Arabia indexes - MSCI Inc. (NYSE:MSCI),http://seekingalpha.com/news/2556696-msci-debuts-saudi-arabia-indexes?source=feed_symbol_msci
MSCI,0.0,0.912,0.087,0.7184,MSCI completes accelerated share repurchase agreement - MSCI Inc. (NYSE:MSCI),http://seekingalpha.com/news/2532516-msci-completes-accelerated-share-repurchase-agreement?source=feed_symbol_msci
MSCI,0.0,0.908,0.092,0.8126,Activist urges MSCI to explore a break-up - MSCI Inc. (NYSE:MSCI),http://seekingalpha.com/news/2210855-activist-urges-msci-to-explore-a-break-up?source=feed_symbol_msci
MSCI,0.025,0.806,0.169,0.8807,MSCI initiates dividend boosts buyback - MSCI Inc. (NYSE:MSCI),http://seekingalpha.com/news/1988985-msci-initiates-dividend-boosts-buyback?source=feed_symbol_msci
MSCI,0.07,0.886,0.044,-0.2732,MSCI quotes & news  Google Finance,http://www.google.ca/finance?q=NYSE:MSCI&amp;amp;client=news-rss&amp;amp;ei=PawuVpn3KYOD2AbI97vwDw
MSCI,0.07,0.886,0.044,-0.2732,MSCI quotes & news  Google Finance,http://www.google.ca/finance?q=NYSE:MSCI&amp;amp;client=news-rss&amp;amp;ei=PawuVpn3KYOD2AbI97vwDw
MSCI,0.04,0.84,0.12,0.9836,MSCI) Short Interest Update,http://www.moneyflowindex.org/msci-inc-nysemsci-short-interest-update/3164458/
MSCI,0.047,0.888,0.065,0.8313,MSCI) Earnings Watch,http://www.investornewswire.com/analyst-views/msci-inc-nysemsci-earnings-watch/51318/
MSCI,0.036,0.905,0.059,0.875,MSCI Inc (NYSE:MSCI) Analyst Price Target,http://www.americantradejournal.com/msci-inc-nysemsci-analyst-price-target/699467/
MSCI,0.075,0.837,0.088,0.6124,Uralkali Falls to 11-Week Low as Funds Sell Before MSCI Removal,http://www.bloomberg.com/news/articles/2015-10-19/uralkali-falls-to-11-week-low-as-funds-sell-before-msci-removal
MSCI,0.019,0.854,0.128,0.9894,Msci Inc (NYSE:MSCI) Stock Price Up as Sentiment Improves,http://www.financialmagazin.com/msci-inc-nysemsci-stock-price-up-as-sentiment-improves/
NRCIA,0.021,0.912,0.067,0.9291,Zacks Upgrades National Research Corp to Hold (NRCIA),http://www.dakotafinancialnews.com/zacks-upgrades-national-research-corp-to-hold-nrcia/509671/
NRCIA,0.003,0.922,0.075,0.9618,National Research Corp (NRCIA) Jumps 5.98% on October 12,http://www.equities.com/editors-desk/stocks/market-movers/national-research-corp-nrcia-jumps-598-on-october-12
NRCIA,0.021,0.897,0.082,0.9526,National Research Corp Upgraded by Zacks to Hold (NRCIA),http://www.lulegacy.com/2015/10/19/national-research-corp-upgraded-by-zacks-to-hold-nrcia/640487/
NRCIA,0.016,0.938,0.046,0.9042,Can National Research Corporation Class A (NASDAQ:NRCIA) Continue to hit ratings?: Will Analysts Continue to rate National Research Corporation Class A a 3 on ratings scale?,http://www.springfieldbulletin.com/can-national-research-corporation-class-a-nasdaqnrcia-continue-to-hit-ratings-will-analysts-continue-to-rate-national-research-corporation-class-a-a-3-on-ratings-scale/70493/
NRCIA,0.019,0.934,0.047,0.9186,National Research Corporation Class A (NASDAQ:NRCIA): Analysts Expecting to report earnings on November 3 2015,http://www.springfieldbulletin.com/national-research-corporation-class-a-nasdaqnrcia-analysts-expecting-to-report-earnings-on-november-3-2015/62145/
NRCIA,0.021,0.91,0.069,0.9291,National Research Corp Raised to Hold at Zacks (NRCIA),http://www.mideasttime.com/national-research-corp-raised-to-hold-at-zacks-nrcia/578327/
MHFI,0.053,0.764,0.183,0.9995,Dividend Aristocrats Part 9 Of 52: McGraw Hill Financial - McGraw-Hill Companies Inc. (NYSE:MHFI),http://seekingalpha.com/article/3580316-dividend-aristocrats-part-9-of-52-mcgraw-hill-financial?source=feed_symbol_mhfi
MHFI,0.022,0.852,0.126,0.9995,McGraw-Hill Financial: After Post-Acquisition SellOff Insiders Buy Millions In Shares - McGraw-Hill Companies Inc. (NYSE:MHFI),http://seekingalpha.com/article/3537746-mcgraw-hill-financial-after-post-acquisition-selloff-insiders-buy-millions-in-shares?source=feed_symbol_mhfi
MHFI,0.042,0.808,0.15,0.9981,Market Pullback Offers Opportunity In McGraw-Hill At A Good Price - McGraw-Hill Companies Inc. (NYSE:MHFI),http://seekingalpha.com/article/3490656-market-pullback-offers-opportunity-in-mcgraw-hill-at-a-good-price?source=feed_symbol_mhfi
MHFI,0.0,0.932,0.068,0.8126,MHFI quotes & news  Google Finance,http://www.google.ca/finance?q=NYSE:MHFI&amp;amp;client=news-rss&amp;amp;ei=UqwuVtGLK8aqjAHY145Q
MHFI,0.0,0.932,0.068,0.8126,MHFI quotes & news  Google Finance,http://www.google.ca/finance?q=NYSE:MHFI&amp;amp;client=news-rss&amp;amp;ei=UqwuVtGLK8aqjAHY145Q
MHFI,0.008,0.921,0.071,0.9826,McGraw Hill Financial Inc (MHFI) Plans Quarterly Dividend of $0.33,http://www.themarketbusiness.com/2015-10-26-mcgraw-hill-financial-inc-mhfi-plans-quarterly-dividend-of-0-33
