symbol,Keywords
CCF,construction-related industrial Corporation telephone reliability BLH2OCK measurement portfolio electronic principal project-oriented MaterialsThe semiconductor Construction electrical ServiWrap Rosphalt50 manufacture industries protective transportation Pennsylvania water-based polyurethane commercial anti-corrosion applications environmental construction architectural anti-static packaging manufacturing manufacturer Industrial installation waterproofing applications containment applications PaperTyger mail-stream protection mechanical 
CFNL,mortgage-backed securities metropolitan Washington metropolitan interest-bearing Residential household individual retirement Administration residential construction industrial non-interest-bearing Financial Corporation portfolio electronic investment Government-sponsored principal receivable traditional management residential commercial relationship securities available-for-sale securities held-to-maturity medium-sized Additionally warehouse capability municipal securities banking-related available-for-sale securities asset-based held-to-maturity securities single-family residential government origination commercial construction-to-permanent government contracting state-chartered community residences investment portfolio secondary long-term commercial investment securities installment Washington ActivitiesThe non-residential securities securities portfolio multi-family retirement/estate investments acquisition attracting 
PNFP,unsecured installment industrial financial interest-bearing ActivitiesPinnacle household Knoxville telephone community individual businesses subsidiary fiduciary electronic investment management FundsThe addition residential Nashville insurance consistent department personalized achieving development individual retirement municipal non-interest commercial medium-sized construction approval mortgage-backed securities SunTrust Financial wholesale ActivitiesThe securities relationship-based Tennessee convenience-centered investment management Insurance 
HAWK,Web-based consulting financial particular single-use ServicesThe packaging direct-to-participant fulfillment private-branded ProductsThe registration International PayPower electronic physical management entertainment technology Incentives incentive improvement application production international Engagement Reloadable authorization general-purpose reloadable third-party MasterCard processing merchant-specific applications Incentive ProductsThe MoneyGram Private-Branded Blackhawk franchise Financial Engagement Solutions reloadable secondary single-use incentive bank-issued third-party distributor redemption customizable reloadable incentive Blackhawk Engagement ServicesThrough capability e-commerce non-reloadable expiration Network-Branded ApplicationsThe Globoforce distribution geographic fulfillment 
URBN,decorative Outfitters contemporary shop-within-shop individual Pizzeria apartment private-label heirloom department showroom offering Wholesale collection accessories assortment wholesale division merchandise furniture customer wellness Anthropologie activewear table-top footwear lifestyle specialty 
WAIR,spherical industrial Hydraulic packaging airline-affiliated compliance distributor nickel-based electronic Assurance high-grade pharmaceutical point-of-use management interconnect electro-mechanical just-in-time assistance reduction hydraulic equipment Chemicals Electronic Components automotive department stock-keeping development mil-circular Adhesives commercial traceable reporting long-term contractual precision anti-friction environmental aerospace as-needed independent maintenance manufacturing provision Industrial installation September additional value-added Locations specific implementation full-service 
FFIN,represent Management financial Grapevine political Granbury Montgomery revocable Alvarado customary commercial testamentary Midlothian insurance short-term retirement residential development Huntsville administration owner-occupied commercial subsidiary Integrated Southeast liability management corporate irrevocable employee Approval Magnolia Association direction held-for-sale Waxahachie capitalization government Bridgeport marketing third-party commercial activitiesThe Financial Insurance checking construction portfolio mortgage-backed accounts Southlake securities available-for-sale Stephenville re-pricing speculation structure correspondent securities brokerage Mauriceville Technology Sweetwater amortized investment commercial development available-for-sale portfolio residence long-term Financial Bankshares regulatory compliance fundsDeposits Weatherford 
SANM,ServicesThe Components after-market portfolio machine-control industrial-grade production infrastructure equipment customers automotive microelectronic aerospace Manufacturing SolutionsThe press-fitting provision progressive transmission applicable architecture end-to-end inspection prototyping frequency transportation lithography integration semiconductor random-access direct-order-fulfillment available direct-order-fulfillment processes processing commercial quick-turn diagnostic regulatory manufacturing respiration end-of-life simulation qualification release-to-volume Technology in-circuit industrial build-to-order functional non-volatile ultrasound management networking introduction fiber-optic manufacture semiconductor manufacturing environmental Enterprise Industrial embedded distribution conformity management equipment high-speed Corporation engineering tomography technology Flextronics International instrumentation interconnect metrology cloud-based manufacturing self-service equipment backplane development configure-to-order information applications Benchmark Electronics enterprise networking fabrication post-manufacturing hydraulic-electro-mechanical procurement mechanical Integrated Manufacturing validation point-of-sale 
SEMG,Amalgamated break-bulk in-country Blueknight activities Oklahoma SemMexico downstream pipelines redelivery wellhead pipelines transport products Trunkline transport principal Transportation combination 527-mile 210-mile government long-haul Platteville operational application independent petroleum production condition TransportationThe third-party pipelines Whitecourt Enterprise Products FacilitiesThe SemLogistics Magellan Midstream independent modification transportation petroleum products LogisticsThe Nottingham SemStream marketing origination processing significant supplier ownership Enbridge Additionally distributer 570-mile Logistics Coloradom Colorado SemCAMS value-added SemGroup Corporation midstream September Manchester unloading underway Wattenberg distribution building 
MIG,alivenotdead Singapore emerging /provider e-commerce business miniblog platform business operating Indonesia Indonesian entertainment community Malaysia application portfolio monetization 
UA,stabilization Asia-Pacific primarily mobility football MyFitnessPal primarily alternative Australia temperature platform management equipment independent specialty Connected Endomondo moisture-wicking international distribution performance COLDGEAR development independent protective HEATGEAR Asia-Pacific marketing third-party third-party distribution gearlines baseball directional cushioning ALLSEASONGEAR softball basketball compression FitnessThe traditional non-performance countries technical wholesale traditional e-commerce Dome-owned products advertising performance regardless MapMyFitness professional distribution 
BEE,Vectorite containing beneficial endophyte management outbound bio-control BVT-CR7 Vectoring containing BVT-CR7 Vectorite delivery integrated dispenser Canada-based development-stage removable International technology 
HBAN,industrial financial institutional Automobile telephone Equipment subsidiary LendingThe Automotive broker-dealer traditional respective Bancshares Incorporated deposits-interest-bearing providing financing deposits-noninterest-bearing residential Insurance brokerage Commercial Specialty disability equipment Huntington Investment inventory automobile dealerships warehouse customers municipal combination government Pennsylvania origination diversified specialty portfolio management BankingThe protection brokerage underwriting Huntington Bancshares Corporate retirement automobile financing fiduciary administration EstateThe automotive dealerships providing commercial investment management liquidity acquisition negotiable certificate 
AEIS,photovoltaic industrial Matsusada Precision Corporation ophthalmic transform abatement frequency Republic solutions measurement Electronics instrumentation products instrumentation conversion productivity Electric partnership Precision Automation semiconductor equipment electrical Lumasense maintenance provider emitting Schneider Electric Huttinger Elektronik measurement solutions Advanced manufacture time-temperature semiconductor industry adjacent processing out-of-warranty precision temperature measurement deposition architectural conversion products Spellman manufacturing Eurotherm organization applications September Instruments analytical instrumentation non-contact temperature in-warranty Concepts designing 
EBAY,marketplace StubHub platforms platforms shipping Android physical standing Marketplace platforms Australia Shopping craigslist enabling commerce platform Facebook condition customers OfficeMax multiple purchase auction-style Guarantee collection delivery applications pre-determined coverage interface Marktplaats Schibsted StubHub customer commerce Marketplace transaction Wal-Mart Shopzilla application programming comparison Websites customizing original shipping Classifieds Classifieds platforms software 
FLY,B737-300QC Management B757-200SF Holdings Corporation individual commercial aircraft portfolio investment B737-900ER B777-200LRF multi-year Aerospace Aviation Intrepid Aviation passenger aircraft operating Macquarie narrow-body passenger leaseback B767-300ER Commercial Aviation AfricaThe wide-body passenger Aircastle 
THG,interruption professional liability industrial financial negligence generation Corporation Specialty regulatory proportional fiduciary watercraft employment investment management catastrophe Commercial compensation contractor equipment earthquake production vandalism performance terrorism non-payment political miscellaneous commercial worldwide independent Homeowners downstream Commercial automobile behavioral commercial medium-sized liability retirement protection international under-served subsidiary reinsurance conjunction distribution manufacturing operational commercial automobile Investment Management connection construction exploration eldercare malpractice healthcare indemnity facultative pollution 
PGX.V,development west-southwest Columbia Cadillac contiguous Canada-based exploration business activity copper-gold Davidson principal business Telegraph acquisition northwest 
CFW.TO,northeast Pennsylvania Saskatchewan Comodoro hydraulic fracturing stimulation pressure production exploration geographical provider services Arkansas Argentina oilfield 
NFG,industrial SegmentNational Corporation southwestern Pennsylvania Production Pennsylvania corporation Marcellus metropolitan Midstream Corporation States/Canadian production California interconnection underground integrated Ellisburg interstate development transportation Pennsylvania processing commercial Distribution Corporation Production SegmentThe unaffiliated Millennium northwestern Appalachian northwestern Pennsylvania York-Canadian exploration residential Exploration distribution 
PSTI,inflammatory Pluristem Therapeutics intramuscular Corporation peripheral Radiation regeneration dimensional placental-derived pulmonary cardiovascular allogeneic placenta-based double-blind radiation hematologic artificial environment early-stage intermittent treatment pursuing intermittent claudication developer evaluation safety/dose-finding clinical-stage development development PLX-PAD efficacy synthetic scaffold Hematopoietic transplantation musculature Mesoblast orthopedic replacement 
KFY,Alexander consulting industrial financial Dimensions Dimensions International intellectual Struggles International recruitment sciences/healthcare Management educational/not-for-profit Professional organizational portfolio Assessment scientific SearchKorn GroupKorn management standardized research-backed assistance methodology KellyOCG multi-tiered portfolio board-level operationalize geographical performance technology assessment personality independent Futurestep combination government Leadership Development Korn/Ferry International senior-level leadership Succession Organization background verification delivering lifecycle mid-level clarifying Consulting geographic Development Dimensions traditional recruitment identifying experience pre-screened actionable Recruitment industry-specific Productized organization non-executive professionals acquisition candidates 
NM,logistics transshipment Logistics Business deadweight Handysize operation transport affreightment Fluviomar Acquisition Corporation Klaveness government-owned Holdings Montevideo international Hidrovia Petrobras charters-in transportation Cobelfret business technical management November commercial OperationsNavios Holdings Shipping Midstream Dreyfus/Cetragpa ownership OperationsNavios Logistics Ultrapetrol Kawasaki Handymax Petropar Logistics handling Business OperationsNavios shipping cabotage business long-term providing 
SSD,Australia Portugal February light-frame do-it-yourself infrastructure residential commercial connection commercial construction materials construction products Switzerland engineering protection mechanical industrial subsidiary Strong-Tie Manufacturing Asia/Pacific 
IDT,MoneyGram application ServicesThe Consumer protocol providers Corporation Platform ServicesThe telephone Luxembourg Platform businesses Solutions business download technology Argentina wholesale international local/long Business platform addition Consumer Net2Phone destination foreign-born sponsorship network-provided automatic corporate identification management real-time interface VoIP-based Gibraltar-based distance-only available satellite Netherlands corresponding residential Initiation Protocol Wholesale Revolution PIN-less Communications Australia Telefonica Trunking Switzerland Platform Solutions Communications business reloadable domestic customer Revolution platform channel-based business December Singapore post-paid e-commerce international long-distance retailers enterprise value-added Identification geographic cloud-based telephony PIN-less international 
MTG,non-insurance subsidiary Residential secondary individual enhancement Investment Corporation delinquent Indemnity Corporation residential four-family fee-based borrower-paid instrument non-owner occupied ancillary InsuranceThe percentage principal available government origination ServicesA non-insurance occupied single-family defaulted non-insurance subsidiary additional performing analysis connection protection subsequent foreclosure 
PAL,development province property Burkina greenstone Ouagadougou exploitation northeast exploration precious exploration-stage evaluation Parallel acquisition 
WSO,industrial Caribbean distributor insulation refrigerant distribution industry residential HVAC/R ductwork inventory ancillary supplies HVAC/R distribution component commercial construction conditioning coverage evaporator refrigeration equipment ductless replacement 
B,development industrial Engineered Components Component Aerospace aftermarket aftermarket packaging aerospace manufacturer technology refurbishment Singapore aerospace aftermarket equipment manufacturer cavitation fabrication application Connecticut Aerospace fine-blanked evaluation honeycomb manufacture Netherlands transportation maintenance commercial component precision Switzerland manufacturing industrial equipment China/Hong Industrial precision-machined high-precision assemblies precision mechanical Solutions healthcare distribution 
ALDR,Adrenocorticotropic Congenital Clazakizumab inflammatory calcitonin gene-related eptinezumab sensitivity preclinical Hyperplasia proof-of-concept Intravenous overproduction transform investigational initiation inflammation cyclase-activating peptide-38 monoclonal development pivotal-stage particular manufacturing clinical-stage biopharmaceutical transmission Eptinezumab transition PROMISE cyclase-activating polypeptide-38 long-term prevention ALD1910 expression pro-inflammatory PRevention therapeutic 
PLT,manufacture wireless Sennheiser Motorola Skullcandy business high-end communication personal computer original equipment enterprise specialty telephone Plantronics telephony Enterprise impaired distribution Bluetooth Consumer manufacturer 
ASB,ServicesThe Management Associated Banc-Corp interest-bearing institutional administration individual retirement Administration phone-based businesses fiduciary information management subsidiary Associated residential transactional Commercial investable nonbanking BusinessThe Association Commercial SpecialtyThe commercial construction intersegment Operations installment commodity relationship-based individuals depository Technology liquidity 
QSII,Management financial eClinicalWorks generation Corporation enterprise-wide appointment functional community athenahealth prescription management configurable electronic interchange management hospital-based Healthcare Management implementation reconciliation cross-enterprise receivable management organizations healthcare information Ambulatory Interoperability Web-enabled maintenance management optimization MediTouch E-learning individual physician cloud-based healthcare available disparate complementary Ambulatory Electronic connectivity ambulatory interoperability Architecture specification preparation transaction-based configuration Healthcare subsidiary information technology subscription vendor-agnostic physician Consulting installation submission developing automatic enrollment accountable technology-based professional electronic remittance QSIDental Information Technology 
NXTM,available in-center hemodialysis Corporation Fresenius lifestyle appropriate accessory treatment cartridge technology Dialysate In-Center volumetric management Cartridge application peritoneal connection PureFlow dialyzer platform clinical Connected treatment integrated treatment Streamline arteriovenous necessary dialysate development dialysate preparation constant-site technique information marketing bio-medical disposable hemodialysis cloud-based computing important pre-attached contamination LockSite needleless manufacturing Medisystems independent dialysis prescription dialysis ButtonHole preparation equipment end-stage apheresis traditional therapeutic flexibility extracorporeal disposable healthcare 
XRAY,impression Consumables Endodontic DENTSPLY International restorative dimensional PROTAPER ultrasonic artificial laboratory principal OSSEOSPEED Laboratory BusinessesThe endodontic DENTSPLY responsible IN-OVATION equipment Orthodontic Additionally XYLOCAINE non-medical intraoral MAILLEFER WELLSPECT manufacture RECIPROC non-dental orthodontic appliances urological specialty diagnostic Healthcare THERMAFIL consumable surgery-related Equipment Developed Laboratory Businesses chairside consumable preparation responsibility ARTICADENT healthcare professional distribution 
STBA,Management Holdings south-central community Jefferson brokerage reinsurer insurance additional ManagementThe Bancholdings investment production nonbanking employee division building Pennsylvania custodian Insurance Corporation commercial BankingThe Westmoreland subsidiary Commonwealth Advisors Washington Community Insurance financial institution executor Allegheny providing Integrity institutions 
LMNR,operations agribusiness Development DivisionAs recycling Limoneira Mercantile agricultural McKevett investment multi-use eight-acre different Australia DivisionThe agribusiness Windfall Investors residential single-family developable grapefruit production California international development attached-housing transportation equestrian marketing commercial specialty commercial development Associated Limoneira Templeton wholesale third-party agricultural Bernardino convenience multi-family Centennial 700-acre quick-serve 
TFX,anesthetic thermodilution Percutaneous Endotracheal Percutaneous Thrombectomy Dickinson single-use introducers Peripherally engineering businesses laparoscopic trans-radial measurement bladeless portfolio endourology Axillo-subclavian technology alternative Percuvance percutaneous five-millimeter suprapubic intranasal single-use respiratory emergency Chlorag+ard technology interventional administration Equipment Manufacturer spirometry embolectomy equipment Trerotola Percutaneous examination Catheterization Hem-o-lok AmericaThe antimicrobial OnControl available obstetric procedures ARROWg+ard temporary Stimucath combination sheath/dilator Positioning bioresorbable withdrawal therapeutic procedures specialty percutaneous diagnostic ventilation management applications catheterization Incorporated performance regulatory Intraosseous manufacturing Precautions Medtronic ErgoPACK AutoFuser Disposable validation FlexBlock intermittent anesthesia Peripheral Atomization pharyngeal Hemodialysis healthcare endotracheal intubation intravenous medications intra-aortic atomization portfolio facilitate Anesthesia 
SHOS,selection neighborhood appliances metropolitan outlet-value products national Sears-branded products DIEHARD CRAFTSMAN Franchisees Independent addition improvement equipment electrical household Craftsman lifestyle segmentThe merchandise furniture installation Hometown KENMORE Appliance Showrooms traditional products Primarily extended-service full-service big-box 
EXPO,HealthThe geotechnical engineering institutional non-pesticide remediation consulting statistical alternative Biomechanics project-by-project litigation Scientific residential recreational ecotoxicology distribution facilities environment petrochemical facilities government automotive intersection transmission Engineering Management Electrical Engineering manufacturing facilities occurrence Management Consulting individual Occupational engineering management geological engineering occupational evaluation foundation load-bearing structures commercial epidemiology construction consulting biological regulatory manufacturing Biomedical Engineering interaction scientific consulting industrial facilities advertising Statistical high-tech toxicology materials-based ScientificThe computational characterization appropriate Industrial Structures Construction Consulting water/wastewater conventional Mechanical Engineering utilization biomedical engineering Environmental mitigation maintenance structures mechanistic particular engineering consulting hydrogeology assessment Engineering rehabilitation antimicrobials/biocides management consulting Regulation Assessment statistical methodology performance workplace ecological restoration industrial structures remediation international environmental technology development environmental biotechnology environmental engineering 
ODFL,Morristown consulting Indianapolis transportation Pennsylvania less-than-truckload Columbus union-free Harrisburg truckload brokerage Tennessee California consumer household inter-regional container breakbulk Greensboro 
ZION,financial community TrustCalifornia Bancorporation investment BankNevada ArizonaNational management residential development community development California international activities municipal BankAmegy ColoradoVectra commercial medium-sized construction servicing brokerage mid-sized correspondent Financial WashingtonThe installment Executive Washington depository professional corporate 
DNR,operations Mountain Donaldsonville Cranfield RegionThe Anticline Mountain RegionThe Martinville Mississippi Hartzog reserves 180-mile southwestern Thompson Jackson northeastern Wyoming Louisiana Heidelberg recovery addition southwest Mississippi trillion southeast longest-producing Greencore Pipeline interest Pipeline non-tertiary reserves Lockhart Crossing independent Denbury equivalent Pipeline Louisiana operating Brookhaven Alabama Hastings Galveston pipeline industrial facility southwestern Wyoming Eucutta different operating LaBarge Mallalieu 
SHLM,transmittance application strength-to-weight cross-linkable polypropylene protective packaging resistance Performance ColorsThe packaging value-added portfolio custom-designed inorganic dimensional stability agriculture thermoplastic ServicesThe equipment multi-national compression utilization interference PlasticsThe Engineered environment Engineered Composites electrical electrical conductivity Additionally pearlescent phosphorescent difficult available customers processing playground high-performance automotive custom-formulated continuous industrial packaging recreation antibacterial temperature performance applications thermochromatic construction additional functionality performance fluorescent Distribution automotive applications ultra-violet translucent structural processes rotational anti-static glow-in-the-dark appearance PowdersThe anti-blocking SolutionsThe ventilation protection renewable-based international distribution polyethylene terephthalate photochromatic Masterbatch cryogenic CompositesThe Engineered 
BHT.V,Columbia district Gold-Silver Braveheart President Property Referendum 4,000-hectare property Rhea/Sirush/Whitewater Property International Property 800-hectare property precious exploration-stage Viking/Ottawa Property locating 
