symbol,Keywords
BPZ,Boston Market Income 
EPRS,request againGo Reuters message 
CKR.V,Province north-northeast Montpellier Corporation southern Buckingham exploration Bethanien district Canada-based property evaluation acquisition 
NBU.V,development Province mineralization business Canada-based exploration-stage north-eastern exploration Davidson interest Property carbonate alteration acquisition locating 
BLRX,development pre-clinical inflammatory cognitive Israel-based synthetic oligonucleotide preclinical-stage development schizophrenia non-surgical treatment registration myocardial infarction neuropathic prevention therapeutic 
GRO.V,Americas Petrogas Chloride resource development northwestern potassium-rich Corporate regional near-surface fertilizer phosphate exploration production Canada-based potential development Ecuador addition 
CERE,Global Other Market 
ATW,completion development offshore Northwest Advantage 400-foot ultra-deepwater drillship Mediterranean Deepwater Semisubmersibles Achiever offshore drilling exploration Ultra-Deepwater operating offshore 350-foot ultra-deepwater semisubmersible Ultra-deepwater 
DXR,BVA-100 Analyzers Corporation hypertension portfolio hyponatremia investment instrumentation intensive treatment congestive screening andrology diagnosis pre-operative diversified surgical conditions anonymous semi-automated fundamental biotechnology autologous 
PNP.TO,early-stage promissory small-cap Investment geographical biotechnology convertible investment portfolio technology investment 
CYTX,development incontinence Therapeutics enzymatic heterogeneous population Celution medical response specific orthopedic complicated cellular biotechnology cardiovascular scleroderma consumable dysfunction 
CBL.TO,possession mid-market management non-dilutive providing financing standalone Corporation providing liquidity traditional inventory asset-based Canada-based revolving acquisition bankruptcy 
ADMS,NAMZARIC chrono-synchronous amantadine tolerability NAMENDA proof-of-concept portfolio chrono-synchronous pharmaceutical hydrochloride extended-release open-label donepezil hydrochloride treatment single-agent available placebo-controlled understanding Pre-Investigational levodopa-induced dyskinesia extended-release developing hydrochloride Parkinson commercialization neurologic 
NBR,Weatherford International engineering International technology Patterson-UTI instrumentation directional Precision maintenance international international offshore offshore available transportation multi-well collection construction well-site land-based countries December exploration drilling-related equipment Helmerich RIGWATCH real-time performance 
REXI,request againGo Reuters message 
PRSS,Shopkeeper appropriate fulfillment TeeSpring appropriate expertise fulfillment technology Spreadshirt different Australia generator entertainment Remembered Corporate Louisville Uncommon crowd-sourced commission Facebook geographical personalized predominant combination user-generated States-based Kentucky commission structure marketplace commission e-commerce experience RedBubble CustomInk User-generated CafePress SmugMug Shutterfly 
PFNX,interferon therapeutic equivalent preclinical randomized Department osteoporosis pharmaceutical ranibizumab teriparatide production candidates biosimilar development biosimilar candidates placebo-controlled collaboration commercial immunogenicity Altimmune Expression clinical-stage biotechnology Interferon Expression Technology prophylactic ProgramsThe bioequivalence enrollment difficult-to-manufacture comparability throughput bioanalytical similarity high-value expression 
ARWR,antitrypsin apolipoprotein Corporation liver-targeted candidates preclinical extra-hepatic portfolio cardiovascular interference overproduction production independent intractable hypoxia-inducible ribonucleic lipoprotein thromboembolic RNAi-based therapeutic transcript hereditary angioedema prophylactic pre-clinical-stage cholesterol low-density lipoprotein Antitrypsin Deficiency therapeutic 
ENTA,Co-Crystal farnesoid Genkyotex co-formulated combination treatment preclinical Astra-Zeneca direct-acting-antiviral Arrowhead Assembly candidate pibrentasvir hepatitis Pulmocide registrational EDP-305 GlaxoSmithKline treatment development-focused biotechnology chemistry-driven approach Paritaprevir Microbio discovery development Medicinova respiratory syncytial combination glecaprevir Biopharma collaboration pan-genotypic EDP-938 Boehringer Ingelheim fixed-dose combination paritaprevir Tobira/Allergan non-alcoholic VIEKIRA inhibitor 
NFLX,television Domestic streaming Entretenimento December Company Streaming International streaming provider NetflixCS original Internet-connected 
WYNN,Vuitton Dunhill Richard Showstoppers Chopard OperationsThe Company operator Schaffhausen developer prosperity entertainment addition Company destination Givenchy spacious interest convention integrate Vacheron Constantin water-based theatrical integrated Bvlgari shopping Reve-The offering Giorgio theatrical production Wedding zodiac-inspired rotunda Nicholas Kirkwood Jaegar-LeCoultre Operations Limited recreation Alexander McQueen Tiffany entertainment production Broadway-style entertainment Jaeger-LeCoultre beverage Ermenegildo Everett 
PATK,decorative industrial hardwood cabinetry manufacturers distributor cathedral addition fiberboard recreational thickness pre-finished production electrical supplier roll-laminated household furniture edge-banding surrounds component commercial miscellaneous slotwall warehouse high-pressure manufacturing lamination fabrication manufacturer building hardwood furniture countertop fabrication aluminum cut-to-size ready-to-assemble furniture fiberglass particleboard distribution 
TSO,products terminaling gathering rail-car Corporation partnership midwestern fractionation pipelines International multi-site Anacortes capacity Marketing Processing transport products independent petroleum California combined Anchorage Emigrant third-party transportation business Terminalling marketing thousand processing operating Missouri Transportation Vermillion processing Gathering December Washington Vermillion Williston Basin/Bakken Carson-Wilmington 
TSLA,company-owned all-wheel industrial financial residential applications All-Wheel products products kilowatt-hour portfolio five-adult passenger Mercedes additional addition Volkswagen 20-inch utility-scale California autopilot performance Lathrop available Netherlands electric rechargeable lithium-ion four-door commercial locations interface Gigafactory gearbox self-consumption Mitsubishi kilowatt-hour Powerpack tailpipe kilowatt-hour Powerwall products over-the-air software Tilburg functionality 
IDRA,Pharmacyclics over-activation modulating autoimmune Pharmaceutical BioLineRx Toll-like preclinical randomized Immunotherapeutics Technology PlatformUsing chemistry-based macroglobulinemia ipilimumab technology DiseasesThe IMO-8400 Intratumoral Modulation Technology Hoffmann-La double-blind checkpoint GlaxoSmithKline third-generation AstraZeneca development oligonucleotide-based combination IMO-8400 development placebo-controlled metastatic IMO-9200 Autoimmune DiseasesThe Telormedix antagonist clinical-stage biopharmaceutical cytotoxic lymphocyte-associated dystrophy commercialization oligonucleotide antagonist Waldenstrom 
GRPN,merchandise inventory household domestic offerings platforms business intelligence alternative technology networks category merchants Shopping application addition Affiliates operational subscriber commission California networking international multiple merchandising marketing public-facing Customers visibility applications particular reservation customer commerce television payment-processing traditional marketing back-end business Collectively optimization affiliate advertising editorial 
GRUB,consolidate geo-location searchable GrubCentralThe proximity WebsiteThe individual GrubCentral re-ordering ProgramThe completion information personalized platform Website-based platform addition WebsitesThe commission functionality Applications template-driven technology administrative OrderHub independent aggregated database restaurant discovery operating MenuPages application Internet-connected WebsitesDiners information available restaurant capability corporate restaurants 
ROYT,turbidite sandstone long-lived reservoir Overlying Underlying Properties Production waterflood injection Remaining conventional Developed Properties additional hydraulic Breitburn Operating California non-producing non-operated Petroleum Institute unconventional equivalent Freeport waterflood statutory dolomitic formation Properties attributable Diatomite formation producing properties development potential acquiring progressive multiple geologic Sawtelle Conventional production formation producing electric submersible BasinThe Diatomite oilfield silica-rich 
NKO.TO,development Bangladesh adjacent Company petroleum production Exploration coastline interest kilometers exploration kilometer 
PVA,development controlled shellfish business marketing processing Spain-based packaging aquaculture December distribution bankruptcy technology transport Pescanova 
FOSL,Internationally BURBERRY EMPORIO accessories cosmetic ProductsThe distributor principal Company-owned Australia Singapore stainless MICHELE sourcing location FOSSIL department European corporate Claiborne development independent EXCHANGE marketing Indonesia MICHAEL specialty diversified distribution Americas international Company-owned e-commerce ultraviolet collection Armitron semi-precious man-made JACOBS lifestyle AccessoriesThe wholesale commercial Websites finished LAGERFELD Malaysia third-party distributors affiliate December distribution physical presence consumer 
SHAK,seasonal outdoor four-ounce cheeseburger non-genetically hamburger blending domestic Comeback all-natural 'Shroom slow-cooked ParkBurger Shack-cago ShackBurger hand-spun operation butter-grilled Shack20 antibiotic-free jalapeno seasonal freshly-squeezed Company artificial ketchup Chick'n roadside Shack-made buttermilk buttermilk marinade applewood available cold-pressed Cheeseburger signature freshly-squeezed lemonade Carpetbagger re-purposed vegetable American cucumber ShackMeister ShackSauce classic Chicago-style Lockhart antibiotic-free cage-free Shack-made organic house-made vanilla hand-dipped cave-aged whole-muscle signature Pooch-ini organism classic American SmokeShack 
ACHN,first-in-human ACH-4471 Therapeutics automating development activities tolerability intellectual preclinical CHEM-ACH interface odalasvir hemolysis portfolio cumbersome ribavirin combination Repository Genentech application biopharmaceutical treatment preclinical development identification Automated Chemistry immune-related development accessing Achillion scientific complement inhibitor competitive information ComplementWiki available information suppression Competitive Intelligence dose-dependent inhibition Achillion Automated Acquisition polymerase inhibitor nucleotide nonstructural complement alternative sovaprevir sofosbuvir infectious Preclinical non-human biological 
SLCA,fracturing Corporation Proppants glassmaking conventional container recovery fiberglass Commercial Specialty ProductsThe Industrial ProppantsIn production five-micron November Hi-Crush Petroleum Institute unconventional commercial specialty precision Specialty ProductsThe architectural filtration manufacturing irreplaceable building selective adsorbent recreation Industrial Fairmount industrial applications connection materials preparative magnesium analytical 
ONVI,purchases Management disclosure intelligence Transactional individual procurement strategic CenterThe procurement activities threshold education information competitor additional procurement-related notification specification improvement transactional information functionality Contractors BidClerk competitive landscape development Metropolitan Statistical government contracts marketing benchmark understand subscription ReportsThe government procurement DatabaseThe customized management customized Analytics procurement information real-time information historical distribution geographic AnalyticsThe 
OCLR,modulating feedback application virtualization Corporation client-side NeoPhotonics Corporation micro-iTLA production positive-intrinsic-negative solutions wavelength technology networks transport form-factor pluggable information miniature computing Lumentum Holdings equipment backhaul manipulate integrate performance integrated high-speed fronthaul receivers Furukawa Electric component bandwidth-intensive transceiver portfolio co-packaged mach-zender transmitter modulator operating high-performance industry Sumitomo Electric transponder pluggable transceiver transmission amplitude long-haul applications 
SFLY,marketplace Pinterest personalized photo-based Snapfish Minnesota Hardcovers BorrowLenses Snapchat technology recognition Pocketbooks photo-based merchandise Cameralends jumbo-sized LensProToGo Invitations equipment production functionality CVS/pharmacy stationery Facebook personalized PicCollage PaperSource wallet-sized marketing Publishing Solutions Wal-Mart MyPublisher Enterprise photographic Microsoft manufacturer building Hallmark Donnelley lifestyle Paperless Vistaprint Hewlett-Packard CafePress shipping Greetings Walgreens Quad/Graphics Shutterfly 
RCKY,Nelsonville specific industrial industrial waterproof breathable activities non-slip accessories comfortable metatarsal portfolio substitute merchants work-related industrial professions personnel stylistic Thinsulate insulation international occupational territory conditions hazardous independent Recreation colorful waterproof government commercial specialty accessory construction all-season sport/hunting authentic manufacturer wholesale distribution lifestyle technical wholesale Authority specific hospitality distribution enforcement 
GEOS,application industrial four-component reservoir ocean-going Corporation Petroleum Equipment ProductsThe Alcatel-Lucent hydrocarbon information Non-Seismic subsurface Geosolutions telemetry environment equipment multi-component electronic pre-press electrical communication construction industries subsequent processing high-definition reservoir architecture non-seismic commercial reservoir monitoring omni-directional Geophysical specialty industrial marine-based three-component land-based Hydrophones transmission traditional exploration flexographic acquisition FairfieldNodal reservoir-monitoring special-purpose retrieval ocean-bottom 
DEPO,Pharmaceutical Therapeutics International diclofenac potassium oxycodone hydrochloride underlying persistent peripheral neuropathy portfolio alternative technology pharmaceutical management NUCYNTA Mallinckrodt inadequate non-steroidal anti-inflammatory tapentadol BioDelivery collaboration immediate XARTEMIS neuropathic gastroretentive around-the-clock evaluation refractory gastroesophageal postherpetic ineffective once-daily gabapentin 
VVUS,available medication exclusive dyslipidemia phosphodiesterase Commission Therapeutics phentermine AstraZeneca formulation International reduced-calorie dysfunction Independent management commercialization mellitus biopharmaceutical treatment marketing GlaxoSmithKline Association development topiramate extended commercial activity overweight Australia Boehringer Ingelheim Pharmaceutical hypertension Commonwealth Obstructive Application weight-related comorbidity indication Supplemental cholesterol STENDRA therapeutic 
WBC,electronic suspension passenger pneumatic conventional mechanical stability equipment manufacturers electronic management electro-mechanical assistance aftermarket hydraulic processing/air management heavy-duty suspension transmission automation foundation Knorr-Bremse emergency anti-lock commercial diagnostic OnGuardACTIVE collision mitigation TX-TRAILERGUARD real-time aerodynamic ESCsmart electronic Continental compressor departure electronic stability mechanical steerability stationary replacement 
MACK,front-line metastatic resistance Merrimack gemcitabine-based trastuzumab PI3K/AKT/mTOR biophysical Fluorouracil Heregulin-driven overexpress biopharmaceutical liposomal doxorubicin candidates discovering chemotherapy non-small consisting monoclonal development combination gemcitabine nab-paclitaxel leucovorin metastatic pancreatic diagnostic anti-endocrine deposition encapsulation insulin-like ONIVYDE oligoclonal therapeutic tetravalent bispecific cytotoxic pancreatic progression non-overlapping applicable therapeutic consisting refractory irinotecan metastatic adenocarcinoma biochemical therapeutic liposomal 
EHIC,event-driven institutional Shanghai pick-up locations drop-off individual reservation International short-term chauffeur different long-term framework automobile Guangzhou Volkswagen Automobiles self-drive subsidiaries transportation first-tier business pursuant Holdings business transportation Shanghai Qiangsheng operating subsidiary promotional inter-office long-term corporate 
SBGI,originator broadcast programming providing broadcast Broadcast Platforms broadcast industry competitive Telemundo investigative expertise non-programming non-media forefront political analysis MundoFox developer television broadcasting Attkinsson mezzanine financing television broadcast entertainment Univision Virginia Sinclair Broadcast arrangement Estrella development Additionally November subsidiaries Dielectric technology innovator independent wrestling promotion Technical marketing Heartland Frederick broadcast Jefferson community developing industry fabricator underwriter subsidiary launching Sinclair manufacturer transmitter developing technical programming Maryland professional wrestling multi-platform encompassing Generation Broadcast Solutions MyNetworkTV over-the-air programming investments acquisition 
ADXS,filolisbac advanced-therapy medicinal Therapeutics high-risk Pharmaceutical osteosarcoma Administration Epidermal individual surgically-resectable technology Oncothyreon antigen/adjuvant candidate KEYTRUDA ADXS-PSA immunotherapy microenvironment pembrolizumab registrational preclinical infectious expressing Oncolytics -associated Medicines monoclonal discovery development Committee combination -Listeriolysin equivalent non-metastatic protection immunotherapies MedImmune designation commercialization Papilloma ADXS-HER2 mutation-associated presenting stimulate anti-tumor clinical-stage biotechnology HPV-associated Technology metastatic castration-resistant therapeutic 
MNGA,industrial firefighting Corporation licensure Equipment MagneTote alternative technology transport feedstock combustion MagneGas2 production gasification hydrocarbon equipment California hydrogen-based alternative ancillary performance development hydro-carbon carbon-rich processing refineries vegetable emergency extraction subsidiary co-combustion industrial equipment wholesale MagneGas2 metalworking verification distribution 
ANTH,Arzneimittel Therapeutics autoimmune membrane-bound Liprotamase CHABLIS-SC fibrosis-related Antagonism PortfolioBAFF blisibimod formulation hematological alternative activating nonclinical Development active-comparator non-inferiority investigational Pancreatic open-label BRIGHT-SC liprotamase biopharmaceutical inflammation maintenance GlaxoSmithKline Replacement biotechnology-derived development PortfolioLiprotamase nephropathy Immunoglobulin CHABLIS-SC1 registration assessor-blind pancreatic non-porcine investigational SOLUTION Escherichia AstraZeneca Blisibimod replacement erythematosus Pancreatic Insufficiency 
FCX,operations Freeport-McMoRan chemical-grade molybdenum Henderson underground Grasberg portfolio operation MinesFCX Louisiana molybdenum concentrate open-pit MinesMolybdenum Arequipa offshore California chemical Atlantic molybdenum chemical MiningIndonesia November Fungurume molybdenum concentrates extraction/electrowinning Molybdenum Tertiary/Cretaceous Indonesia OperationsIts non-operating operating Democratic Republic Deepwater Operations RefiningThe molybdenum conversion MiningAfrica Haynesville concentrates MiningSouth southeastern 
FNSR,subsystem communication applications Fabry-Perot transmitting Corporation synchronous International reconfigurable multi-terabit wavelength converting integrity fundamental optical-electrical form-factor pluggable wavelength selective subsystems conjunction temperature add/drop multiplexer technology equipment manufacturers integration electronic equipment fiber-to-the-home/curb semiconductor hierarchy functionality telecommunication equipment microprocessor communication optoelectronic interface networking/synchronous integrated manufacture multiplexing technologies telecommunication SONET/SDH point-to-point real-time monitoring polarization optoelectronic packaging Modulators wavelength management LCoS-based architecture telecommunication applications in-service gigahertz manufacturing intrinsic additional transmission applications embedded transmission capability integrated waveguide SONET/SDH-based telecommunication optics-based transport interconnecting 
BCC,industrial wholesale distributor residential construction facilities ProductsThe combining insulation agricultural Weyerhaeuser manufacturing integration distributor distribution facilities improvement residential repair-and-remodeling manufacturer remodeling manufacture ponderosa composite commercial DistributionThe Georgia-Pacific Distribution Corporate structural Louisiana-Pacific Corporation appearance particleboard multi-family 
ARIA,Other Market 
MDRX,EHR-agnostic Web-based throughput management Management athenahealth automating traditional on-premise Information Corporation utilization management Allscripts Healthcare facilities Radiology registration Infor-Med Allscripts Professional electronic coordination value-based HealthCare Corporation actionable management eClinicalWorks Allscripts FollowMyHealth engagement administration Healthagen cloud-based operational operational intelligence Ambulatory point-of-care identification Information Technology maintenance performance stand-alone electronic post-acute administrative Population point-of-care population Wellcentive departmental enterprise-wide Allscripts TouchWorks connectivity ambulatory Diagnostics MEDHOST healthcare-related multi-site CareInMotion information technology population installation submission documentation management functionality Enterprise Scheduling Healthcatalysts accountable multi-specialty PracticeFusion healthcare 
REXX,Marcellus Devonian independent Pennsylvania Corporation equivalent Illinois exploration drilling interest Appalachian developmental Including 
HART,manufacture Denmark-based industrial packaging production Furthermore Verpackung Hartmann-Schwedt Hartmann-Mai production Hartmann-Hungary machinery geographical molded-fiber packaging Broedrene customer portfolio 
PLPM,reconciliation Conversion settlement multiple acquiring localized language provider Americas multi-currency processing international Multi-Currency end-to-end authorization processor transaction processing 
EMITF,CompaniesThe Management autoimmune Holdings apartments gynecology clinical development metastasis oncology thalassemia Platform appropriate Therapeutics Construction malignant hematological International operation ultrasound treatment electronic regenerative palliation conference management entertainment residential treatment platform Commercial application production initiation treatment equipment clinical technology operational commercial CentersThe Radisson development Supersonic IndiaThe business non-cancerous marketing population expansion commercial umbilical Bangalore Neuropathic metabolic construction operating investee subsidiary conjunction InSightec Essential Cellerant Therapeutics Mesoblast N-acetylmuramic mixed-use neurosurgery Parkinson transplantation indication hematopoietic TriGranit corporation resonance restaurants ExAblate Zgorzelec multiplex 
PERY,Direct-to-Consumer Nicklaus accessories womenswear International sportswear Kingdom Laundry internationally loungewear demographic swimwear Rafaella Callaway department international footwear independent product multiple outerwear regional multi-brand specialty collection direct-to-consumer Original underwear Munsingwear Cubavera activewear e-commerce Licensing distribution licensor corporate Sportswear 
JACK,selection company-operated fast-casual hamburger guacamole offering restaurant capacity quick-service restaurants specialty October operated drive-in breakfast 3-cheese Brunchfast BoxJack District Columbia 
AMDA,identical technology platform Corporation CeramTec commercial products titanium adherent corrosion-resistant Medtronic replacement implants commercial biomaterial Composite non-silicon Posterior candidates cobalt-chromium composition manufacture interbody nitride-based combination composite load-bearing thoracolumbar monolithic orthopedic developing December Transforaminal Aesculap products replacement 
TTS,third-party consumer Superior Ridgeway Wisconsin network travertine Michigan Holdings Company regional sandstone Virginia product portfolio specialty retailer products maintenance installation distribution porcelain 
DHT,building Limited February management capacity newbuilding Suezmax deadweight Corporation Marshall Shipholding Maritime Goodwood technical Management Chartering international operation Aframax 
