symbol,Keywords
SKX,athletic non-slip stability responsive value-oriented Columbia Sportswear high-rebound recreational character Designed industrial-inspired Skechers Performance z-shaped colorful SportThe department foot-cooling leather-sole V-Stride on-the-GO footwear long-wearing Characteristics GOimpulse SkechersBOBS Athletic Timberland athletic-styled Holdings built-in interactive Wolverine ultra-lightweight Resalyte Performance NasonThe California lifestyle adaptive multitude movement available Skechers on-the-GO attention Luminators cushioning water-resistant materials Skechers zig-zag on-trend Resalyte compound technical trend-right international wholesale Air-Mazing youthful compromising air-cushioned athletic footwear flexibility seam-sealed waterproof adornments addition Collection Elastika high-abrasion lightweight aluminum flexible Casuals/Modern all-weather protection Keepsakes specialty construction footwear retailers wholesale distribution Skechers-branded lifestyle footwear specialty breathable wholesale forefoot gel-infused footwear collection performance footwear low-profile collection Skechers Lightweight International Corporation mid-tier retailers Skech-Air comfortable water-resistant athletic-inspired lightweight low-profile everyday athletic lifestyle glow-in-the-dark technology efficient slip-resistant electrical espadrille collection warehouse ActiveThe Skechers S-Lights multiple WorkSkechers sport-influenced collection style-conscious lifestyle footwear independent retailers marketing campaign traditional e-commerce materials Primarily abrasion-resistant business-to-business consumer 
FULT,Management interest-bearing Residential individual retirement Lafayette Ambassador telephone Financial Corporation portfolio agricultural electronic information automobile overdraft partnership Swineford equipment variable-rate noninterest-bearing municipal securities Government securities customers multi-bank financial residential Pennsylvania transferring commercial mortgage-backed securities construction subsidiary manufacturing investment securities loan-to-value Pennsylvania Financial ActivitiesThe traditional healthcare investment management distribution 
DY,providers telephone engineering equipment necessary telecommunication management inspection personnel construction management maintenance underground foundation customers infrastructure multiple electric specialty expansion utilities wireless construction CertusView Technologies deployment placement conjunction fabrication television installation stand-alone connection equipment installation distribution 
JWN,Nordstrom full-line Bernardino fulfillment selection Nordstrom purchases Cardholders participate fulfillment addition clearance merchandise inventory off-price merchandise available specialty limited-time lifestyle merchandise e-commerce business Nordstrom-branded private-label brand-name off-price Nordstrom SegmentThe clearance Nordstrom-branded full-line 
ESI,development numerical simulation accordance government performing education simulation environment engineering France-based performance distribution manufacturing electronic manufacturer electromagnetism 
NEWT,financial non-affiliate Administration wholesale brokerage infrastructure solutions management investment CrystalTech Wisconsin Advantage Paymentech Technology Solutions Processing Microsoft platform inventory marketing controlled portfolio development commercial Insurance Insurance Solutions closed-end management Receivable Financing Heartland processing medium-sized non-diversified closed-end Accounts Receivable approval ancillary processing Universal Processing Retrieval information technology PMTWorks processing equipment Computing brokerage insurance Authority e-commerce BlueHost iPowerWeb providing Electronic servicing 
PKG,manufacture industrial communication protective packaging Minnesota packaging combining International Louisiana sheet-only Wisconsin Michigan conventional shipping linerboard performance complement development DeRidder transportation Tomahawk specialty Procurement Packaging Corporation Georgia-Pacific containerboard manufacturing WestRock commodity technical Washington multi-color sensitive Tennessee rotogravure distribution semi-chemical corrugating 
LAZ,insurance selection Evercore institutional partnership strategic Neuberger appropriate individual analyzing potential acquisition Citigroup alternative management Advisory business business ManagementThe Greenhill leveraged sovereign investment Brussels circular AdvisoryThe Schroders fundamental Management business government marketing Rothschild investment philosophy Australia preparing alternative investment situation Bernstein convertible Research valuation Francisco structure structural Frankfurt Templeton financial advisory mezzanine Singapore Bordeaux JPMorgan Financial Advisory connection Barclays Centerview long-term investment management Fidelity corporate acquisition 
BCLI,endothelial Therapeutics peripheral Hepatocyte differentiation technology Brainstorm Glial-derived neurotrophic double-blind Brain-derived neurotrophic neuron-supporting intramuscular intrathecal Subsidiary Neuralstem development neurotrophic Sclerosis dose-escalating subsidiary important neuro-protective Amyotrophic developing multi-center Parkinson neurodegenerative biotechnology marrow-derived mesenchymal 
URI,equipment available industrial contractor supplies South-Central aluminum hydraulic distribution equipment Northeast specialty construction skid-steer temperature Southeast rentalsThe equipment maintenance underground handling equipment customers petrochemical infrastructure manufacturers electrical distribution Mid-Atlantic subsidiary industrial equipment Industrial database December construction Solutions homeowner equipment geographic 
CVEO,logistics development facility management generation Corporation redeployment Killdeer Gunnedah Northwest Australian McClelland offshore locations completion conventional Australia Columbia addition Saskatchewan contractor production maintenance integrated multitude province infrastructure temporary corridor business medium-term Structures villages expansion construction Karratha operational exposure accommodation operational workforce Logistics Athabasca Middlemount December expansions Coppabella Fleetwood Corporation operating personnel Oilfield Holdings wastewater treatment long-term skid-mounted swimming expansionary 
SGBK,interest-bearing Holdings Residential household individual retirement residential mortgage-backed mixed-use properties planning agricultural portfolio insurance planning Stonegate management additional certificate Government residential Commercial investment Southeast Construction inventory Assistance development Stonegate Financial commercial medium-sized construction acquiring equipment September corporate official Properties individual owner-occupied depository retirement planning automatic Investment adjustable-rate 
RSTI,development Companys structure management reorganization electric Russia-based Rossiyskiye research construction interregional activity distribution numerous 
ATR,industrial antibiotic household packaging components packaging medication solutions Argentina pharmaceutical management elastomer components Pharmaceutical applications non-dispensing elastomeric flow-control unpreserved medicinal granular Applications fragrance decorative components Injectables AptarGroup automotive continuous disposable infusion diagnostic applications lyophilization Switzerland Injectable BeverageThe obstructive pulmonary respiratory prescription September ophthalmic dispensing elastomer pre-filled dispensing healthcare injectable packaging solutions anti-thrombotic replacement 
SCU.TO,Company-operated property espresso-based Canada-based specialty Espresso single-origin connection coffee-related portfolio operation Territory Paradiso certified 
CSGS,marketplace wholesale settlement Corporation convergent business intelligence involvement interaction management International Alcatel-Lucent monetization management cloud-based subscriber real-time mediation integrated satellite business activation collection framework real-time wholesale business Singleview models-direct mediation stand-alone Convergent business management professional Ericsson presentment 
RS,Metalcenter Corporation distribute domestic Sheppard Illinois Continental titanium galvanized shipbuilding agricultural heat-treated aluminum industries equipment Australia Jorgensen Singapore stainless hot-rolled Precision Flamecutting Aerospace Stainless Manufacturing Divisions transportation Aluminum multiple Metalweb processing specialty miscellaneous delivery aerospace manufacturing National Specialty semiconductor fabrication structural non-residential construction Distributors aluminum industry cold-rolled Malaysia inventory management Allegheny Liebovich 
ATVI,PlayStation Skylanders franchises Entertainment action/adventure intellectual licensing StarCraft international developer Hearthstone developer game-related distribute role-playing user-generated warehousing third-party intellectual properties Centresoft first-person Activision competitive interactive entertainment Distribution properties subscription-based publisher television multi-player connectivity Microsoft Corporation simulation Activision Publishing subscription logistical distribution publishing 
LMT,distribute multi-mission spacecraft Ballistic submarine-launched intercontinental portfolio modernization production network-enabled activities customers government TrainingThe LANTIRN satellites land-based capability automatic generation intelligence E2-C/E2-D Geostationary Operational modernization activities Foundation Antarctic Contractor Logistics multi-variant generation capabilities Government integration Atmospheric Association international multi-role infrastructure transportation scientific intercontinental ballistic Positioning commercial surface-to-surface management defensive combatant information technology automation environment technical simulation network-enabled situational airlifter navigation technology advancement SystemsThe communication Administration strategic Capability-3 shoulder-fired anti-armor space-based narrow-band situational awareness cybersecurity ballistic Operational Environmental helicopter utilizing prototype manufacture ground-based ItsTPQ-53 Navigation Aeronautics international customers Frequency exploration service-life extension reconnaissance air-to-ground Information Corporation artillery engineering sustainment Objective technology Development information Air-to-Surface surveillance equipment department Extremely development Multi-Purpose Technical meteorological ControlThe applications fixed-wing readiness transportable defensive Automation Modernization SolutionsThe organization 
EGN,development represent exploratory Corporation equivalent reserves operational production exploration drilling sidetrack subsidiary pay-adds 
OREX,Therapeutics Administration bupropion hydrochloride reduced-calorie Medtronic management Scientific naltrexone Genentech biopharmaceutical treatment Endosurgery GlaxoSmithKline weight-related comorbid combination overweight regulatory approval expenditure September physical activity EnteroMedics Dynamics 
PDS,equipment business Directional Corporation certification equipment maintenance production engineering Production exploration procurement international distribution manufacturing 
CGE.V,development Zacatecas Corporation Penasquito Oriental hectares exploration Goldcorp interest operating precious exploration-stage acquisition discovery 
SPNC,Management pacemaker saphenous occurrence Cardiovascular non-laser mechanical aspiration catheters VascularSingapore selection Biotronik International Quick-Cross portfolio CVX-300 GlideLight alternative Medtronic cardiovascular preparation management drug-eluting SightRail mechanical extraction laser-assisted Scientific Corporation semi-compliant AngioSculpt peripheral equipment QuickCat aspiration small-diameter periphery conventional angioplasty fiber-optic Intervention ProductsThe Spectranetics Corporation thrombus management Turbo-Power catheters angioplasty catheters physician Turbo-Elite Peripheral atherectomy TightRail Management ProductsThe AngioSculpt Mechanical defibrillator procedures SightRail flow-limiting Stellarex drug-coated thrombectomy molecular guidewire non-fiber-optic Turbo-Tandem peripheral atherectomy restenosis thrombus traversable thrombus-laden distribution geographic Intervention 
DYN,industrial financial Richland Holdings gas-fired Ontelaunee Illinois Louisville Interconnection generation facilities Masspower Washington facilities Independence municipal Generating coal-fired Electric residential Pennsylvania Connecticut production California Massachusetts transmission organization principal business independent generating electric business Midcontinent Independent commercial ancillary electric generating aggregate September wholesale Homefield Conesville Tennessee California Independent distribution Authority 
WABC,Corporation non-agency residential individual asset-backed securities non-agency residential collateralized principal safekeeping Government residential non-agency commercial California noninterest-bearing independent Investment securities commercial construction subsidiary transaction installment Westamerica Bancorporation ActivitiesThe securities portfolio businesses providing 
INWK,gathering financial pre-sorting LogicSource competitive packaging displays print-ready technology Williams marketing execution management on-demand transactional continental production copywriting integrated marketing collateral business processing permanent order-by-order inventory management merchandise Donnelley installation September pre-media procurement hospitality Quad/Graphics collateral development fulfillment 
VSI,in-store experience selection Mytrition management products supplement ProBioCare Betancourt Nutrition assortment Nutri-Force Columbia additional multi-channel specialty BodyTech Cellucor available nutrition Probiotic complement extending Supplements homeopathic manufacturing manufacturer Rite-Aid Wal-Mart September wellness stand-alone labeling e-commerce products glucosamine Walgreens Vitapath 
MMS,Web-based ServicesThe Staffline enrollment counseling welfare-to-work disability consulting advancement multi-channel self-service independent disability eligibility determination job-readiness preparation technology Interserve Affordable provincial educational management Government Assessment engagement administration Management Information beneficiary modernization government assistance Automated occupational administrative independence development independent employment infrastructure reconciliation invoicing government eligibility independent verification multilingual processing allocation state-based MAXIMUS assessments information technology oversight enrollment transition compensation Information Technology professional consulting long-term validation application assistance government-sponsored 
DAVE,selection coleslaw Approximately licensing off-the-grill flame-grilled prototypical Company-owned country-roasted addition off-the-grill barbecue exterior smokestack wood-smoked barbeque available business complement designated appetizer Pudding hickory-smoked Company-owned restaurants Louis-style Commonwealth restaurant industry regional barbeque franchise-operated restaurants full-service signature restaurants 
BGG,Industries generation accessories PowerBoss horsepower Stratton Corporation four-cycle aluminum principal Simplicity gasoline engine-powered Stratton products marketer Metalcraft independent Techtronic Industries pressure Craftsman subsidiary Kawasaki manufacturer walk-behind September gasoline Husqvarna Mayville products original equipment distribution consumer replacement 
IRDM,residential ServicesThe selection per-minute satellite communications OpenPort Commercial peripheral telephone reactivation value-added frequency Department protocol electronic fixed-asset monitoring terrestrial information Satellite management networking additional expiration broadband personnel political situational awareness subscriber equipment intelligence community push-to-talk satellite constellation ancillary November submarine communications administrative ship-to-shore development independent infrastructure scientific emergency government commercial activation talkgroup non-governmental respective Shipping connectivity construction fixed-wing satellites beyond-line-of-sight conjunction wholesale distribution air-to-ground telephony recreation auxiliary transceiver ServiceThe compatible Globalstar command-and-control architecture logistical industrial location-based high-value ORBCOMM Telecommunications 
PCAR,Mississippi industrial ServicesPACCAR Peterbilt nameplates independent petroleum Aftermarket Netherlands technology Chillicothe Columbus Australia Gearmatic off-highway Commercial aftermarket equipment inventory over-the-road administrative manufacture division Eindhoven owner/operator Peterbilt construction subsidiary manufacturing commercial trucking Financial nameplate wholesale Washington Substantially distribution heavy-duty commercial acquisition 
EOG,Mountain 500-foot Patricio producer Anadarko Delaware Consortium Republic liquids-rich Argentina Kingdom Parkman productive Wisconsin Government undeveloped condensate cumulative production Additionally offshore Trinidad international include development StatesEOG multiple interest additional exploration Marcellus equivalent processing Mid-Continent Modified formation drilling Wolfcamp Kleberg producing Caribbean Nitrogen OperationsThe contract exploitation anhydrous ammonia exploration Neuquen Province activity Williston Niobrara Trinidad 
PSK.TO,Interests PrairieSky British Columbia Saskatchewan dimensional Interest Corporation Canada-based portfolio Seismic Canadian Sedimentary 
TISI,metallurgical radiographic resistance management development non-destructive evaluation Management ultrasonic turnaround/project measurement computational instrumentation Compliance management unpiggable temperature NDT/NDE electromagnetic professional installation Engineering Assessment ultrasonic inspection flammable atmosphere identification Freeze-stop maintenance examination assessment deformation Line-stop internal/external pipe/tube traditional inspection petrochemical downstream engineering assessment risk-based integrated fitness-for-service processing petrochemical industries quantitative inspection construction on-stream exchanger Mechanical specialty industrial information Inspection gas-fired combustion maintaining serpentine technology-enabled long-range Williamson InsertValve technical machining machinery mechanical analytical providing inspection machining equipment procedure 
IVZ,institutional Approximately Continental investment management factor-based investment technology insurance absolute sovereign high-conviction fundamental customizable non-profit strategies independent government Asia-Pacific diversified supermarket architecture platform September traditional white-labeled third-party financial quantitative management industry Sino-foreign 
MLM,limestone environmental applications residential construction Louisiana underground limestone industrial businesses Midlothian agricultural supplier agriculture different Dallas/Fort residential Aggregates limestone aggregate Southeast production BusinessThe dolomitic infrastructure non-residential processing Specialties BusinessThe specialty environmental Specialties aggregate producing November underground Colorado Michigan Ludington magnesia-based Mid-America construction long-term distribution wastewater 
USCR,industrial District Oklahoma volumetric ready-mixed ARIDUS formulation laboratory alternative technology operation Columbia Michigan production California building business commercial delivery concreteThe aggregate standard ready-mixed placement ready-mixed Washington productsThe distribution geographic 
ANH,financing Association borrowing securitization asset-backed Corporation residential mortgage-backed risk-adjusted government-sponsored enterprise newly-formed securitization Management Non-Agency Residential subordinate portfolio distribution first-lien residential investment acquisition principal 
LPX,operations industrial ProductsThe category BoardThe Columbia residential Engineered pre-finished Additionally AmericaThe manufacturer structures building commercial accessory construction SmartSide structural Louisiana-Pacific Corporation wholesale distribution commodity remodeling transition wood-based sheathing professional two-step 
THS,industrial GroceryThe Protenergy Corporation single-serve foodservice products TreeHouse packaging foodservice industry preservative-free encompass repackaging sweeteners category conventional manufacturing wholesome offering whitener foodservice customers production macaroni enchilada refrigeration industrial customers isotonic ingredient specialty retailers customers beverages controlled business microwaveable regional Non-dairy cook-on-stove pressure American flexible subsidiary packages categories Industrial Associated restaurant packaging environment Flagstone non-dairy products spoonable retailers ExportThe Industrial distribution consumer 
S.TO,development Sherritt International partnership metallurgical processing Varadero lateritic Ambatovy production exploration interest agricultural operation Corporate 
BKD,ServicesThe Retirement multi-story recreational activities activities Corporation dementia-care communities community concierge Management transportation pathology education medication coordination retirement additional assistance recreational LivingThe Welltower unconsolidated Alzheimer ancillary occupational CentersThe available independent Brookdale emergency reimbursement Brookdale Ancillary outpatient companion management ownership communities supplemental management agreements physician multi-story communities mid-acuity CCRCs-Rental Ancillary ServicesThrough check-in providing dietitian 
CTO.V,manufacture Canadian electrical business marketing transmission equipment electrical industry telephone Enterprises protection Canada-based subsidiary manufacturing fabrication 
TWO,interest-only financing pass-through financial prepayment to-be-announced Government investing commercial mezzanine residential mortgage-backed investment Non-Agency repurchase Advisers servicing Corporation long-term Investment Association adjustable-rate 
ARDX,glucagon-like Utilizing gastrointestinal ProgramThe additional constipation-predominant intestinal transporter clinical-stage biopharmaceutical discovery development cardio-renal phosphorus open-label pharmacodynamic transporter sodium-hydrogen sodium-hydrogen exchanger non-absorbed polystyrene commercialization hyperphosphatemia absorption secretagogue inhibitor therapeutic 
FPRX,Therapeutics cisplatin tolerability non-randomized nivolumab immuno-oncology candidate multicenter physiological docetaxel parallel-group open-label villonodular GlaxoSmithKline inflammation discovering single-agent cancer-promoting fibroblast discovery development proliferation combination macrophages tumor-associated macrophages mesothelioma activation third-party carboplatin companion fibroblast inhibition metastatic squamous over-produced preliminary over-expressed three-arm potential immunosuppressive tumor-associated paclitaxel molecular diagnostic metastatic colon/rectal clinical-stage biotechnology expression therapeutic 
CHNR,excavation nonferrous Republic concentration geologic physical Development respective principal activity additional Multi-metallic non-ferrous micaceous extraction transportation combination Yangchong processing mining-non-ferrous construction Exploration separation successive subsidiary December exploitation exploration distribution acquisition 
PAYX,remittance financial multi-product calculation workforce management individual purchasing preparation accounting portfolio technology Essentials receivable information respective retirement participant implementation payroll-related ancillary administration outsourcing cloud-based self-service Accounting production quarterly Readychex administrative integrated Solutions available specialist temporary government software-as-a-service processing collection medium-sized attendance employee-related professional cloud-based accounting distribution mid-market Financial electronic management small-business applicable technology-enabled connection full-service organization regulatory compliance employees 
SNCR,communication information management device/service Activation customer-facing embedded connectivity technology Integrated physical management platform software-based activation providing non-intrusive platform Activation engagement integration cloud-based equipment custom-branded non-intrusive multi-factor accessing Synchronoss workflow Synchronoss Activation additional communication multi-channel understanding converged communication important Enterprise arranging m-commerce self-register back-office infrastructure-related transaction multi-factor authentication portability September broadband connectivity experience Synchronoss Enterprise e-commerce identity/access management directory inventory management distribution providing 
DRC,Swedish development Industrial transportation business Denmark industry processing automation Technology/Production engineering maintenance support acquisition 
