symbol,Keywords
JAZZ,obstructive endothelial endogenous neurotransmitter coli-derived asparaginase Pharmaceutical gamma-hydroxybutyrate Administration Commission Intrathecal formulation lymphoblastic adjunctive management gamma-aminobutyric single-stranded administration Defibrotide application narcolepsy hypersensitivity biopharmaceutical intolerant chemotherapy intravenous authorization veno-occlusive chrysanthemi sleepiness defibrotide intrathecal pharmacological deoxyribonucleic restoration programmable conjunction supplemental pharmaceutical ingredient coli-derived transplantation ziconotide non-opioid intrathecal refractory intramuscular productsThe asparaginase hematopoietic 
VR,selection institutional participate pre-launch satellite proportion production Syndicate facultative subscription downstream aerospace conjunction Reinsurance non-appearance Australia ReValidus analytical indemnity accumulation interruption financial occurrence generation catastrophic insurable authority individual International reinsurer Assurance Singapore investing AlphaCat international evaluation terrorism frustration/trade mercantile Penn-America complement commercial Securities protection Stratford Insurance technical malpractice occurrence-based specialty insurance Malaysia Bermuda-based investment contingency cancellation professional liability industrial fraud/criminal third-party liability commercial habitational indemnity insurance management Reaseguros political disability Liability composite Bermuda-based reinsurance construction professional indemnity particular Switzerland catastrophe reinsurance exception AlphaCat investors Endurance Specialty compensation exploration Insurance machinery breakdown marketplace Hampshire WorldWestern PartnerRe retrocession RenaissanceRe first-party collateralized agriculture malicious AlphaCat Reinsurance uncorrelated Professional indemnity attachment Underwriting reinsurance transactions miscellaneous malpractice accidental expropriation Burlington Insurance short-tail aggregate misappropriation Specialty Insurance Scottsdale Insurance AlphaCat Insurance correlation facultative 
NBG,Web-based institutional management activities businesses portfolio settlement Bulgarian catastrophe Exchange transport equipment Insurance products operational investment advisory division customers interbank custodian small-medium brokerage subsidiary provision furniture countries financial products Yugoslav Republic automatic Management reclamation International insurance entertainment bancassurance products international Piraeus-based infrastructure commercial agreement diagnostic Securities BankingThe restructuring protection Macedonia investment insurance repurchase brokerage earthquake Bulgaria Thessaloniki warehousing December OperationsThe shipping derivative products long-term financing intersegment consulting individual customers Stopanska management networking ManagementThe third-party liability sovereign independent insurance medium/long Vojvodjanska consultancy investment retirement insurance transaction subsidiary Consumer traditional commercial financing ultra-high collision Household distribution Insurance non-traditional investors activities portfolio management corporate customers information different Bancassurance Romaneasca investment products investment modification subsidiaries insurance products Investment BankingThe reporting educational collection medium-sized diversified financial Corporate non-Greek bilateral insurance brokerage Investment traditional responsibility machinery Interbanking corporate unit-linked investment AD-Sofia 
JBL,consulting industrial communication application-specific manufacturing infrastructure packaging engineering frequency fulfillment Manufacturing ServicesThe leveraging information enclosure Flextronics International Development management electro-mechanical Singapore implementation investment equipment production Gerresheimer Corporation AptarGroup Computer-Assisted verification development Netherlands configure minimization automotive continuous component accessory Electronics Manufacturing Mechanical Benchmark Electronics technologies Validation electronic manufacturing information technology prototyping Industrial Technology broadband appliance testability Diversified Manufacturing procurement Engineering three-dimensional mechanical healthcare analytical validation Electronic 
FMC,industrial Corporation LithiumThe functional Specialty stability herbicide portfolio microcrystalline cellulose Agricultural SolutionsThe difficult-to-control agricultural herbicides Nutrition nutritional ingredients NutritionThe Farmoquimica Albemarle Corporation production control-release pharmaceutical pesticide diversified specialty nutraceutical protection portfolio functional ingredient Agricultural Phosphorous technology-intensive specialty structure formulation ingredients professional Rettenmaier carrageenan 
CBL,CoolSprings Additional BuildingsThe Crossings community non-controlling Operating Partnership occupied investment Buildings non-anchor Pittsburgh Greenbrier Nashville Suburban Smithfield Courtyard Cobblestone Greensboro Additionally Monroeville department Properties perimeter Chattanooga Stabilized shopping business Chesapeake lease-up midwestern aggregate Grandview self-administered Marshalls properties self-managed Associated mixed-use Partnership Waynesville Community CentersThe open-air Building corporate southeastern Non-stabilized 
ASNA,BryantAs high-density District suburban individual Catherines clothing everyday sportswear Columbia e-commerce operations surrounding suburban wear-to-work footwear specialty international territories plus-size merchandise lifestyle namesake dressbarn merchandise assortment occasion JCPenney 
CASM,multi-parameter oxygenation inclusion hemoglobin measurement quantitative measurement penetrate technology different monitoring veterinary equipment manufacturer percentage Hutchinson Technology non-invasive emergency numerical MAXNIBP outpatient Traditional Monitoring Hamamatsu abdominal algorithm FORE-SIGHT distribution 
ETR,generating Wholesale CommoditiesThe generation Corporation non-nuclear Mississippi Wholesale Commodities short-term interruptible transmission nuclear-fueled production wholesale customers ownership Wholesale aggregate subsidiary distribution Louisiana integrated participation 
SYNC,Fee-Based home-based auto-authentication multiplatform Recurring Discovery management E-mail/Collaboration consumers entertainment monetizing End-to-End Authentication Platform business government Activision Blizzard white-label Symantec Corporation Advertising short-form television technology development Microsoft Corporation actionable enterprise nonprofit Electronic 
BCEI,prospective Productive liquids-weighted extension three-dimension production liquids-rich McCallum southern Arkansas oil-rich Columbia additional Smackover majority oil-producing Dorcheat Macedonia development independent vertical Mid-Continent equivalent processing southern Lafayette capacity horizontal Colorado December liquids-weighted exploration Wattenberg Niobrara Continent acquisition 
APL,consulting refurbished centrifuge environmental Corporation processing Unlimited Machining Unlimited equipment balancing maintenance geographic Oilfield 
DIN,restaurant operations selection operationsThe franchise District alcoholic Approximately operationsRental operations International breakfast category company-operated franchise restaurants pre-opening equipment franchise-related non-alcoholic operationsFinancing operations Financing Applebee restaurant operationsThe specialty operating DineEquity restaurant industry Missouri franchise Columbia Franchise operations Restaurants franchisee-operated financing Neighborhood Cincinnati advertising company-operated restaurants Steakhouse franchise operations restaurants 
JMI,development palaeochannel Australia mineralization non-core low-grade secondary carnotite Palaeochannel divestment windblown well-sorted exploration reassessment progress pre-development advanced-stage Exclusive Prospecting principal 
TRAK,Trakopolis information interfacing third-party commercial integration cloud-based equipment business intelligence application programming Canada-based location-based electronic 
COLM,development wholesale customer-designated Shanghai locations Columbia Sportswear warehouse facility Australia majority-owned addition Guangzhou concession-based shop-in-shop locations equipment employee equipmentThe manufacture independent February Netherlands Kentucky e-commerce customers warehouse adventure direct-to-consumer wholesale customers brand-specific e-commerce merchandise wholesale distribution lifestyle countries specific e-commerce e-commerce products Hardwear geographic Carlsbad 
SAFM,operations Mississippi facility northeastern southwestern Palestine Robertson Louisiana Sanderson Hazlehurst production Production Division Processing Division business marketing processing subsidiary Freestone Flowood preparation distribution southeastern 
CALM,institutional national packaging production southwestern ProductsEgg mid-western wholesome foodservice arrangement mid-Atlantic cage-free Egg-Land customers marketing regional specialty southeast American Farmhouse September vegetarian hatchery facilities critical computer-controlled distribution non-specialty southeastern Cal-Maine 
HIW,development industrial properties management Greensboro Pittsburgh Partnership customer-related properties Richmond construction Nashville portfolio in-service properties investment acquisition 
CXO,Grayburg sandstone technology completion multi-pay Commercial stimulation Southeast Spraberry multi-year inventory evaluation development independent February equivalent horizontal development Wolfcamp stratigraphic horizontal oil-prone exploration activity acquisition 
RAIL,metallurgical financial FreightCar railroads DynaStack articulated industrial transporting portfolio agricultural low-density non-intermodal VersaFlood aluminum-bodied longitudinal stainless petroleum woodchip equipment AutoFlood international structural Manufacturing stainless steel-bodied independent three-pocket transportation municipal Aluminum commercial transverse discharge manufacturing five-pocket fabrication manufacturer intermodal doublestack intermodal aluminum-bodied flat-bottom Greenbrier Companies machinery components two-pocket distribution automatic 
PGI,completion prospective pre-development activity gold/silver refractory Paciencia government reprocessing Perseverancia refractory concentrate exploration operation suitable evaluation Dominican Republic 
LEAF,Escalona Coopertief environmental investing generation hydroelectric Investments traditional Islands-based production Invenergy SkyFuels Renovables alternative Energentum renewable 
ALNY,paroxysmal nocturnal complement-mediated Therapeutics Arrowhead single-dose Pharmaceutical ESC-GalNAc conjugate angiotensinogen tolerability dyslipidemia therapeutic Pharmaceuticals Investigational hypertension antitrypsin pregnancy ProgramsThe cardio-metabolic dose-escalation GlaxoSmithKline N-acetylgalactosamine cardiovascular Development convertase subtilisin/kexin additional open-label double-blind interference deficiency-associated Healthcare Pharmaceuticals investigational biopharmaceutical multi-dose ProgramsALN-AAT non-alcoholic nocturnal hemoglobinuria University Hemophilia hypertensive placebo-controlled ribonucleic amyloidotic polyneuropathy Biovitrium Infectious hypertriglyceridemia Apolipoprotein proprotein convertase ESC-GalNAc-siRNA conjugate TTR-Mediated Amyloidosis deficiency checkpoint inhibitor hepatocyte-expressed Cardio-Metabolic randomized ALN-TTR02 Therapeutic developing early-stage Stabilization developing Biopharma Corporation ascending- infectious -conjugate single-blind collaboration agreement Angiopoetin-like ALN-PCSSC GalNAc-conjugate initiating liver-expressed 
ILMN,sample-to-answer translational pharmaceutical Scientific commercial molecular Affymetrix preimplantation reversible terminator-based microscopic noninvasive California whole-genome sequencing diagnosis government Asia-Pacific whole-genome reproductive-health data-storage deoxyribonucleic sequencing array-based manufacturing BaseSpace BeadArray technology substrate reproductive molecular diagnostic preparation sequencing technology terminator-based sequencing biotechnology 
TZR.V,completion additional evaluation Sandstone Development business Project production Development Project McMullen Maverick LaSalle 
MPC,ultra-low industrial transportation operations anode-grade polymer-grade propylene northeastern distillation Mississippi polymer-modified blendstocks refinery-grade propylene Louisiana transport feedstock Cincinnati catalytic Marketing condensate petroleum fuel-grade southeastern Louisiana production chemical-grade propylene MarketingThe Additionally marketing customers international Midstream partially-owned Petroleum Corporation independent non-operated petrochemical transportation Extension marketing specialty refineries Greenville catalytic reforming southeast propylene desulfurization ownership aggregate Catlettsburg refineries Speedway convenience merchandise Galveston confluence atmospheric gas-processing non-food condensate stabilization non-owned blend-grade Speedway Garyville Marathon-branded independent Cleveland refinery-based fractionation inter-coastal 
ARRS,Multichannel /Converged content-carrying Commscope Voice/Data Broadband Corporation Technetix telephone integration Equipment bandwidth frequency Amplifiers broadcast satellite International Amplitude Modulator information Infrastructure compression subscriber-owned entertainment broadband encryption transmission equipment refurbishment surveillance subscriber equipment functionality Concurrent CloudThe InnoTrans Programmer Equipment Verimatrix infrastructure telecommunication modulation correlation Embedded Multimedia converged management subscribers substitution Termination EquipmentThe fiber-coaxial television Gainspeed workforce management technical Programming Distributors SeaChange International Technicolor transmission Quadrature Amplitude Solutions Insertion advertisement placement professional distribution Transport Interactive 
OTIC,available Therapeutics unilateral technology sustained-exposure ciprofloxacin candidate Sustained-Exposure Treatment biopharmaceutical treatment TinnitusThe suspension sustained-exposure formulation development Sustained-Exposure single-dose commercial expansion N-Methyl-D-Aspartate DisordersThe dexamethasone placement antagonist gacyclidine tympanostomy Sensorion physician-administered antibacterial commercialization pediatric 
KNX,Logistics utilizing destination Transportation non-trucking nationwide equipment personnel third-party providers intermodal independent contractors alternative transportation management asset-based Refrigerated Intermodal contractual temperature-controlled truckload truckload transportation additional 
VSH,Inductors non-commodity capacitor industrial Resistors computing high-current proximity correction TrenchFET MOSFETs frequency STMicroelectronics optoelectronic components illumination MOSFETs portfolio medium-voltage TrenchFET electronic solid-state surface-mount electrostatic discharge conversion management through-hole rectifier technology electrical appliance multilayer electronic manufacturing light-emitting Inductors segmentThe outsourcing Fairchild Semiconductor Components segmentThe equipment regulation electronic components electrical microprocessor switching high-voltage manufacture independent attenuation protection Intertechnology automotive automation equipment vehicle/electric Capacitors high-speed applications amplification backlighting low-voltage TrenchFET aerospace converter discharge segmentThe semiconductor components electronic circuitry renewable manufacturer TDK-EPCOS industrial high-voltage Schottky rectifier commodity thyristors/silicon-controlled transmission Semiconductors integrated regulator integrated photodiode electronic component household electrical coordinate 7-segment Panasonic smartphone electromagnetic interference Optoelectronic Components 
CVT,Australia Wairarapa Paengaroa Kingdom European marketing Medical Northland Comvita Limited extraction production Whanganui ownership plantation Queensland international manufacturing manufacturing facility 
AWI,Saint-Gobain Rockwool International Armstrong facility institutional December contractors commercial Georgia-Pacific Corporation products Building Products residential suspension manufacturing Worthington Armstrong Odenwald Faserplattenwerk 
LNN,application irrigation industrial irrigation equipment automation technology Corporation non-redirective PaveGuard T-shaped Netherlands ArmorGuard agricultural Australian delineation agriculture transportation landscape temporary applications redirective communication technology management monitoring FieldNET Ukrainian Quickchange electronic equipment protective equipment X-Tension equipment production TAU-B_NR international construction manufacture independent infrastructure energy-absorbing municipal government marketing guardrail continuous specialty accessory applications Infrastructure GrowSmart filtration injection manufacturing distribution subscription TAU-II-R Irrigation necessary Greenfield Australia SegmentAs accommodating Diversified Manufacturing machine-to-machine Watertronics groundwater SegmentThe automatic Universal acquisition replacement 
SJT,function Vizcaya Argentaria Burlington principal operator business northwestern Southland available Underlying Properties production NMWHFIT non-mortgage subsidiary percentage attributable investment principal 
LJPC,Pharmaceutical excessive life-threatening LJPC-30Sb LJPC-30Sa LJPC-30SbLJPC-30Sa formulation myelodysplastic muscular dystrophy hereditary hemochromatosis pharmaceutical Angiotensin angiotensin absorption biopharmaceutical endogenous discovery development High-Output renin-angiotensin Gentamicin component significant catecholamine-resistant hypotension life-threatening condition thalassemia commercialization regulator next-generation gentamicin accumulation 
REGN,REGN1908-1909 Neovascular inflammatory intolerance Auto-inflammatory alirocumab hypercholesterolemia dyslipidemia intravitreal collaboration Bispecific Evinacumab VelocImmune Syndromes non-infectious pharmaceutical REGN910-3 additional Collaboration HealthCareThe non-familial retinopathy LDL-cholesterol Dupilumab biopharmaceutical AstraZeneca interleukin-6 subcutaneous heterozygous Trap-based respiratory REGN2810 Therapeutics extracellular monoclonal degeneration development neovascular age-related homozygous REGN1979 combination ARCALYST neovascularization activation GlaxoSmithKline Cryopyrin-Associated monotherapy Nesvacumab/aflibercept PharmaThe authorization REGN2222 Pharmaceutical REGN1033 recombinant maximally-tolerated interleukin-4 PDGFR-beta co-formulated atherosclerotic cardiovascular Mitsubishi aflibercept ProgramsThe lipid-lowering infectious Ophthotech Corporation commercialization REGN1500 VelocImmune technology iso-osmotic eosinophilic cholesterol Developing IndependentlyThe rheumatoid low-density lipoprotein prevention candidates 
DE,operations front-end ForestryThe construction providing financial construction equipment Corporation skid-steer locations agricultural equipment pull-behind providing real-time Argentina agriculture landscape equipment management information attachments available management equipment operations utilization addition technology agricultural management equipment Caterpillar engine/power performance application equipment independent Netherlands business sugarcane Tigercat handling commercial construction four-wheel-drive ServicesThe financial walk-behind Australia self-propelled foregoing equipment electronic component products wholesale financing preparation machinery geographic equipment attachments 
CGNX,available consulting SystemsThe one-dimensional VisionPro Corporation Application single-purpose ProductsThe measurement two-dimensional hand-held information management Manufacturers automobile appropriate manufacturing computer-based integration application production functionality maintenance identification integrated manufacture graphical flowchart-based programming pharmaceutical automotive peripheral equipment general-purpose automation applications In-Sight SensorsThe manufacturing configuring technical programming Displacement verification fixed-mount distribution SoftwareThe 
SPN,Completion ServicesThe Weatherford International abandonment perforating engineering Production transport intervention completion management hydraulic stimulation equipment production maintenance non-magnetic development independent temporary Technical End-of-life mechanical Products Incorporated surface-controlled manufacturing accommodation technical end-of-life industry Schlumberger Halliburton hydraulic fracturing customer-specific SolutionsThe optimization exploration containment geographic 
HIBB,mid-sized educational SportsThe AdditionsThe merchandising facility wholesale Alabaster fashion-based Approximately equipment Mid-Atlantic mall-based free-standing Additions athletic supplier subsidiary assortment merchandise Southwest 
DXCM,stabilization cellular Corporation Administration rechargeable self-contained generation continuous wireless connection blood-based insertion Bluetooth technology Medtronic PLATINUM information Australia monitoring Panasonic Healthcare SweetSpot cloud-based application clinical treatment Additionally subcutaneous pediatric indication development Healthcare Holdings graphical processing single-point continuous disposable standard ambulatory understand Conformite Europeene Diagnostics approval healthcare providers secondary transmitter Pediatric Indication database uploading commercialization specific handheld professional wire-like electrode researchers 
AIMC,high-speed compressor pneumatic construction equipment diaphragm Electromagnetic universal synchronous aggregate disengage equipment Slovakia portfolio Formsprag non-manufacturing applications Ameridrives Regal-Beloit Corporation Pennsylvania miter/bevel Wisconsin vehicular applications residential Michigan hydraulic generation Connecticut stainless off-shore Corporation made-to-order refrigeration compressor Svendborg transportation BrakesThe Electromagnetic Transmission automotive processing commercial specialty precision Industrial applications land-based industrial application aerospace overrunning productivity horizontal manufacturing Industrial elastomeric transmission assemblies walk-behind BrakesThe miniature agricultural equipment machinery Lamiflex mechanical off-highway electromagnetic 
APAM,Management long-only characteristics diversification Small-Cap risk-adjusted competitive fundamental investment investment-related production capability Non-United generative portfolio availability shareholder-oriented management risk-rating assessment Francisco capitalization political objective analytical possession providing investment decision-making advantage Developing acceptable diversified cash-producing sustainable autonomous investment inflation relationship Milwaukee intrinsic investment strategies diversified portfolio conviction identifying non-investment non-United fundamental long-term investment management corporate 
ADT,independent customers telephony technical communication commercial CLOUD-SIP cloud-based hardware connectivity CLOUD-Telephony CLOUD-Contact maintenance portfolio information technology 
SFUN,ServicesThe financial marketplace decoration value-added primarily E-commerce company-specific information Customers residential improvement application assessment Subscription development government servicesThe applications membership financing transaction Financial home-related traditional e-commerce re-modeling home-decorating value-added servicesThe improvement-related 
A,compliance laboratory instrumentation plasma-atomic dissolution partnership laboratory portfolio pathology consultative Hybridization Generation Sequencing management productivity application absorption operational equipment laboratory automation production identification instrument molecular preparation immunohistochemistry Hematoxylin chromatography pharmaceutical analytical laboratory measurement deoxyribonucleic determination informatics segmentThe application-focused Manufacturing methylation synthesized laboratory instrument capability biological spectrometry expression 
KEX,Mississippi Northeast in-house Illinois compression products Louisiana acrylonitrile feedstock EngineThe overhaul generator capabilities offshore dry-bulk production customers petrochemical emergency offshore petroleum Missouri transportation distribution land-based Washington Transport replacement transportation companies distributor operation generation operators Hawaiian Atlantic Division assistance shore-based tankerman Linehaul TransportationThe movement transportation petroleum products isobutane component residual generation customers Ouachita Agricultural chemicals Brownsville medium-speed installation industry products agricultural chemicals industrial facility Oklahoma anhydrous nitrogen-based Arkansas off-highway distributor Offshore Transportation Tennessee-Tombigbee condensate equipment manufacturer reduction California manufacture operators Pressurized products finished propylene representative subsidiary in-field safety-related products remanufacture distribution oilfield hydration equipment high-speed Corporation butadiene horsepower petroleum exploration equipment Tennessee Atlantic offshore transportation independent fertilizer offshore commercial Intracoastal Waterway off-highway 
